{
  "empresa": {
    "ticker": "AGRO",
    "nome": "BRASILAGRO – COMPANHIA BRASILEIRA DE PROPRIEDADES AGRÍCOLAS",
    "cnpj": "07.628.528/0001-59"
  },
  "ultima_atualizacao": "2026-01-09T09:22:46.601434",
  "total_noticias": 384,
  "noticias": [
    {
      "data": "2026-01-08",
      "data_hora": "2026-01-08 18:00:05",
      "titulo": " 08/01/2026",
      "headline": "ECO SEC AGRO (ECOA) CRA E:190 S:1 Comunicado ao mercado - 08/01/2026",
      "conteudo": null,
      "url": "https://sistemasweb.b3.com.br/PlantaoNoticias/Noticias/Detail?idNoticia=3198269&agencia=18&dataNoticia=2026-01-08%2018:00:05",
      "id": 3198269,
      "categoria": "Aviso"
    },
    {
      "data": "2026-01-08",
      "data_hora": "2026-01-08 16:24:54",
      "titulo": " 08/01/2026 16:00",
      "headline": "ECO SEC AGRO (ECOA) CRA E:327 S:1(s) ATA AGOE - 08/01/2026 16:00",
      "conteudo": null,
      "url": "https://sistemasweb.b3.com.br/PlantaoNoticias/Noticias/Detail?idNoticia=3197966&agencia=18&dataNoticia=2026-01-08%2016:24:54",
      "id": 3197966,
      "categoria": "Governança"
    },
    {
      "data": "2026-01-08",
      "data_hora": "2026-01-08 16:23:24",
      "titulo": " 08/01/2026 15:45",
      "headline": "ECO SEC AGRO (ECOA) CRA E:237 S:1 ATA AGOE - 08/01/2026 15:45",
      "conteudo": null,
      "url": "https://sistemasweb.b3.com.br/PlantaoNoticias/Noticias/Detail?idNoticia=3197964&agencia=18&dataNoticia=2026-01-08%2016:23:24",
      "id": 3197964,
      "categoria": "Governança"
    },
    {
      "data": "2026-01-08",
      "data_hora": "2026-01-08 16:21:10",
      "titulo": " 08/01/2026 15:30",
      "headline": "ECO SEC AGRO (ECOA) CRA E:166 S:1 ATA AGOE - 08/01/2026 15:30",
      "conteudo": null,
      "url": "https://sistemasweb.b3.com.br/PlantaoNoticias/Noticias/Detail?idNoticia=3197959&agencia=18&dataNoticia=2026-01-08%2016:21:10",
      "id": 3197959,
      "categoria": "Governança"
    },
    {
      "data": "2026-01-08",
      "data_hora": "2026-01-08 16:19:22",
      "titulo": " 08/01/2026 15:15",
      "headline": "ECO SEC AGRO (ECOA) CRA E:106 S:1(s) ATA AGOE - 08/01/2026 15:15",
      "conteudo": null,
      "url": "https://sistemasweb.b3.com.br/PlantaoNoticias/Noticias/Detail?idNoticia=3197954&agencia=18&dataNoticia=2026-01-08%2016:19:22",
      "id": 3197954,
      "categoria": "Governança"
    },
    {
      "data": "2026-01-08",
      "data_hora": "2026-01-08 16:16:58",
      "titulo": " 08/01/2026 15:00",
      "headline": "ECO SEC AGRO (ECOA) CRA E:120 S:1(s) ATA AGOE - 08/01/2026 15:00",
      "conteudo": null,
      "url": "https://sistemasweb.b3.com.br/PlantaoNoticias/Noticias/Detail?idNoticia=3197949&agencia=18&dataNoticia=2026-01-08%2016:16:58",
      "id": 3197949,
      "categoria": "Governança"
    },
    {
      "data": "2026-01-08",
      "data_hora": "2026-01-08 16:15:01",
      "titulo": " 08/01/2026 14:45",
      "headline": "ECO SEC AGRO (ECOA) CRA E:116 S:1 ATA AGOE - 08/01/2026 14:45",
      "conteudo": null,
      "url": "https://sistemasweb.b3.com.br/PlantaoNoticias/Noticias/Detail?idNoticia=3197946&agencia=18&dataNoticia=2026-01-08%2016:15:01",
      "id": 3197946,
      "categoria": "Governança"
    },
    {
      "data": "2026-01-08",
      "data_hora": "2026-01-08 16:12:20",
      "titulo": " 08/01/2026 14:30",
      "headline": "ECO SEC AGRO (ECOA) CRA E:84 S:1 ATA AGOE - 08/01/2026 14:30",
      "conteudo": null,
      "url": "https://sistemasweb.b3.com.br/PlantaoNoticias/Noticias/Detail?idNoticia=3197940&agencia=18&dataNoticia=2026-01-08%2016:12:20",
      "id": 3197940,
      "categoria": "Governança"
    },
    {
      "data": "2026-01-08",
      "data_hora": "2026-01-08 16:10:59",
      "titulo": " 08/01/2026 14:15",
      "headline": "ECO SEC AGRO (ECOA) CRA E:75 S:1(s) ATA AGOE - 08/01/2026 14:15",
      "conteudo": null,
      "url": "https://sistemasweb.b3.com.br/PlantaoNoticias/Noticias/Detail?idNoticia=3197937&agencia=18&dataNoticia=2026-01-08%2016:10:59",
      "id": 3197937,
      "categoria": "Governança"
    },
    {
      "data": "2026-01-08",
      "data_hora": "2026-01-08 16:08:57",
      "titulo": " 08/01/2026 14:00",
      "headline": "ECO SEC AGRO (ECOA) CRA E:1 S:102(s) ATA AGOE - 08/01/2026 14:00",
      "conteudo": null,
      "url": "https://sistemasweb.b3.com.br/PlantaoNoticias/Noticias/Detail?idNoticia=3197934&agencia=18&dataNoticia=2026-01-08%2016:08:57",
      "id": 3197934,
      "categoria": "Governança"
    },
    {
      "data": "2026-01-08",
      "data_hora": "2026-01-08 13:38:41",
      "titulo": " 08/01/2026 11:30",
      "headline": "ECO SEC AGRO (ECOA) CRA E:354 S:1(s) ATA AGOE - 08/01/2026 11:30",
      "conteudo": null,
      "url": "https://sistemasweb.b3.com.br/PlantaoNoticias/Noticias/Detail?idNoticia=3197463&agencia=18&dataNoticia=2026-01-08%2013:38:41",
      "id": 3197463,
      "categoria": "Governança"
    },
    {
      "data": "2026-01-08",
      "data_hora": "2026-01-08 13:34:14",
      "titulo": " 08/01/2026 11:15",
      "headline": "ECO SEC AGRO (ECOA) CRA E:332 S:1(s) ATA AGOE - 08/01/2026 11:15",
      "conteudo": null,
      "url": "https://sistemasweb.b3.com.br/PlantaoNoticias/Noticias/Detail?idNoticia=3197447&agencia=18&dataNoticia=2026-01-08%2013:34:14",
      "id": 3197447,
      "categoria": "Governança"
    },
    {
      "data": "2026-01-08",
      "data_hora": "2026-01-08 13:30:30",
      "titulo": " 08/01/2026 11:00",
      "headline": "ECO SEC AGRO (ECOA) CRA E:308 S:1 ATA AGOE - 08/01/2026 11:00",
      "conteudo": null,
      "url": "https://sistemasweb.b3.com.br/PlantaoNoticias/Noticias/Detail?idNoticia=3197437&agencia=18&dataNoticia=2026-01-08%2013:30:30",
      "id": 3197437,
      "categoria": "Governança"
    },
    {
      "data": "2026-01-08",
      "data_hora": "2026-01-08 13:26:57",
      "titulo": " 05/01/2026 10:45 (R)",
      "headline": "ECO SEC AGRO (ECOA) CRA E:200 S:1 ATA AGOE - 05/01/2026 10:45 (R)",
      "conteudo": null,
      "url": "https://sistemasweb.b3.com.br/PlantaoNoticias/Noticias/Detail?idNoticia=3197432&agencia=18&dataNoticia=2026-01-08%2013:26:57",
      "id": 3197432,
      "categoria": "Governança"
    },
    {
      "data": "2026-01-08",
      "data_hora": "2026-01-08 11:57:55",
      "titulo": " 08/01/2026 10:30",
      "headline": "ECO SEC AGRO (ECOA) CRA E:131 S:1(s) ATA AGOE - 08/01/2026 10:30",
      "conteudo": null,
      "url": "https://sistemasweb.b3.com.br/PlantaoNoticias/Noticias/Detail?idNoticia=3197218&agencia=18&dataNoticia=2026-01-08%2011:57:55",
      "id": 3197218,
      "categoria": "Governança"
    },
    {
      "data": "2026-01-08",
      "data_hora": "2026-01-08 11:54:51",
      "titulo": " 08/01/2026 10:15",
      "headline": "ECO SEC AGRO (ECOA) CRA E:145 S:1(s) ATA AGOE - 08/01/2026 10:15",
      "conteudo": null,
      "url": "https://sistemasweb.b3.com.br/PlantaoNoticias/Noticias/Detail?idNoticia=3197214&agencia=18&dataNoticia=2026-01-08%2011:54:51",
      "id": 3197214,
      "categoria": "Governança"
    },
    {
      "data": "2026-01-08",
      "data_hora": "2026-01-08 11:52:09",
      "titulo": " 08/01/2026 10:00",
      "headline": "ECO SEC AGRO (ECOA) CRA E:100 S:1 ATA AGOE - 08/01/2026 10:00",
      "conteudo": null,
      "url": "https://sistemasweb.b3.com.br/PlantaoNoticias/Noticias/Detail?idNoticia=3197207&agencia=18&dataNoticia=2026-01-08%2011:52:09",
      "id": 3197207,
      "categoria": "Governança"
    },
    {
      "data": "2026-01-08",
      "data_hora": "2026-01-08 08:29:33",
      "titulo": " 07/01/2026",
      "headline": "ECO SEC AGRO (ECOA) CRA E:422 S:1 AVISO AO MERCADO - 07/01/2026",
      "conteudo": null,
      "url": "https://sistemasweb.b3.com.br/PlantaoNoticias/Noticias/Detail?idNoticia=3196734&agencia=18&dataNoticia=2026-01-08%2008:29:33",
      "id": 3196734,
      "categoria": "Aviso"
    },
    {
      "data": "2026-01-08",
      "data_hora": "2026-01-08 08:29:33",
      "titulo": " 07/01/2026",
      "headline": "ECO SEC AGRO (ECOA) CRA E:422 S:1 Lamina de Oferta - 07/01/2026",
      "conteudo": null,
      "url": "https://sistemasweb.b3.com.br/PlantaoNoticias/Noticias/Detail?idNoticia=3196735&agencia=18&dataNoticia=2026-01-08%2008:29:33",
      "id": 3196735,
      "categoria": "Outros"
    },
    {
      "data": "2026-01-08",
      "data_hora": "2026-01-08 08:29:33",
      "titulo": " 07/01/2026",
      "headline": "ECO SEC AGRO (ECOA) CRA E:422 S:1 PROSPECTO PRELIMINAR - 07/01/2026",
      "conteudo": null,
      "url": "https://sistemasweb.b3.com.br/PlantaoNoticias/Noticias/Detail?idNoticia=3196736&agencia=18&dataNoticia=2026-01-08%2008:29:33",
      "id": 3196736,
      "categoria": "Outros"
    },
    {
      "data": "2026-01-08",
      "data_hora": "2026-01-08 08:29:33",
      "titulo": " 06/01/2026",
      "headline": "ECO SEC AGRO (ECOA) CRA E:422 S:1 TERMO SECURITIZACAO. - 06/01/2026",
      "conteudo": null,
      "url": "https://sistemasweb.b3.com.br/PlantaoNoticias/Noticias/Detail?idNoticia=3196737&agencia=18&dataNoticia=2026-01-08%2008:29:33",
      "id": 3196737,
      "categoria": "Outros"
    },
    {
      "data": "2026-01-07",
      "data_hora": "2026-01-07 18:19:14",
      "titulo": " 28/01/2026 11:00",
      "headline": "ECO SEC AGRO (ECOA) CRA E:259 S:1(s) EDITAL AGOE - 28/01/2026 11:00",
      "conteudo": null,
      "url": "https://sistemasweb.b3.com.br/PlantaoNoticias/Noticias/Detail?idNoticia=3196479&agencia=18&dataNoticia=2026-01-07%2018:19:14",
      "id": 3196479,
      "categoria": "Governança"
    },
    {
      "data": "2026-01-07",
      "data_hora": "2026-01-07 18:07:41",
      "titulo": " 28/01/2026 16:00",
      "headline": "ECO SEC AGRO (ECOA) CRA E:311 S:1 EDITAL AGOE - 28/01/2026 16:00",
      "conteudo": null,
      "url": "https://sistemasweb.b3.com.br/PlantaoNoticias/Noticias/Detail?idNoticia=3196440&agencia=18&dataNoticia=2026-01-07%2018:07:41",
      "id": 3196440,
      "categoria": "Governança"
    },
    {
      "data": "2026-01-07",
      "data_hora": "2026-01-07 16:19:41",
      "titulo": "53  Informe Mensal  12/2025",
      "headline": "FI AGRO FYTO (FTCA) 42.537.438/0001-53 - Informe Mensal - 12/2025",
      "conteudo": null,
      "url": "https://sistemasweb.b3.com.br/PlantaoNoticias/Noticias/Detail?idNoticia=3196206&agencia=18&dataNoticia=2026-01-07%2016:19:41",
      "id": 3196206,
      "categoria": "Outros"
    },
    {
      "data": "2026-01-07",
      "data_hora": "2026-01-07 13:42:52",
      "titulo": " 14/01/2026 11:00",
      "headline": "ECO SEC AGRO (ECOA) CRA E:137 S:1(s) PROPOSTA AGOE - 14/01/2026 11:00",
      "conteudo": null,
      "url": "https://sistemasweb.b3.com.br/PlantaoNoticias/Noticias/Detail?idNoticia=3195976&agencia=18&dataNoticia=2026-01-07%2013:42:52",
      "id": 3195976,
      "categoria": "Governança"
    },
    {
      "data": "2026-01-07",
      "data_hora": "2026-01-07 13:40:36",
      "titulo": " 26/01/2026 10:00",
      "headline": "ECO SEC AGRO (ECOA) CRA E:295 S:1(s) PROPOSTA AGOE - 26/01/2026 10:00",
      "conteudo": null,
      "url": "https://sistemasweb.b3.com.br/PlantaoNoticias/Noticias/Detail?idNoticia=3195971&agencia=18&dataNoticia=2026-01-07%2013:40:36",
      "id": 3195971,
      "categoria": "Governança"
    },
    {
      "data": "2026-01-07",
      "data_hora": "2026-01-07 13:38:54",
      "titulo": " 22/12/2025",
      "headline": "ECO SEC AGRO (ECOA) CRA E:333 S:1(s) RELAT. DE RATING - 22/12/2025",
      "conteudo": null,
      "url": "https://sistemasweb.b3.com.br/PlantaoNoticias/Noticias/Detail?idNoticia=3195966&agencia=18&dataNoticia=2026-01-07%2013:38:54",
      "id": 3195966,
      "categoria": "Outros"
    },
    {
      "data": "2026-01-07",
      "data_hora": "2026-01-07 13:37:53",
      "titulo": " 22/12/2025",
      "headline": "ECO SEC AGRO (ECOA) CRA E:18 S:1 RELAT. DE RATING - 22/12/2025",
      "conteudo": null,
      "url": "https://sistemasweb.b3.com.br/PlantaoNoticias/Noticias/Detail?idNoticia=3195963&agencia=18&dataNoticia=2026-01-07%2013:37:53",
      "id": 3195963,
      "categoria": "Outros"
    },
    {
      "data": "2026-01-07",
      "data_hora": "2026-01-07 13:36:41",
      "titulo": " 28/01/2026 14:30",
      "headline": "ECO SEC AGRO (ECOA) CRA E:394 S:1 PROPOSTA AGOE - 28/01/2026 14:30",
      "conteudo": null,
      "url": "https://sistemasweb.b3.com.br/PlantaoNoticias/Noticias/Detail?idNoticia=3195958&agencia=18&dataNoticia=2026-01-07%2013:36:41",
      "id": 3195958,
      "categoria": "Governança"
    },
    {
      "data": "2026-01-06",
      "data_hora": "2026-01-06 19:38:44",
      "titulo": " 09/01/2026 16:15",
      "headline": "ECO SEC AGRO (ECOA) CRA E:373 S:1(s) PROPOSTA AGOE - 09/01/2026 16:15",
      "conteudo": null,
      "url": "https://sistemasweb.b3.com.br/PlantaoNoticias/Noticias/Detail?idNoticia=3195255&agencia=18&dataNoticia=2026-01-06%2019:38:44",
      "id": 3195255,
      "categoria": "Governança"
    },
    {
      "data": "2026-01-06",
      "data_hora": "2026-01-06 19:35:38",
      "titulo": " 09/01/2026 15:45",
      "headline": "ECO SEC AGRO (ECOA) CRA E:379 S:1(s) PROPOSTA AGOE - 09/01/2026 15:45",
      "conteudo": null,
      "url": "https://sistemasweb.b3.com.br/PlantaoNoticias/Noticias/Detail?idNoticia=3195254&agencia=18&dataNoticia=2026-01-06%2019:35:38",
      "id": 3195254,
      "categoria": "Governança"
    },
    {
      "data": "2026-01-06",
      "data_hora": "2026-01-06 19:33:58",
      "titulo": " 09/01/2026 16:00",
      "headline": "ECO SEC AGRO (ECOA) CRA E:376 S:1(s) PROPOSTA AGOE - 09/01/2026 16:00",
      "conteudo": null,
      "url": "https://sistemasweb.b3.com.br/PlantaoNoticias/Noticias/Detail?idNoticia=3195253&agencia=18&dataNoticia=2026-01-06%2019:33:58",
      "id": 3195253,
      "categoria": "Governança"
    },
    {
      "data": "2026-01-06",
      "data_hora": "2026-01-06 19:32:33",
      "titulo": " 09/01/2026 15:30",
      "headline": "ECO SEC AGRO (ECOA) CRA E:371 S:1 PROPOSTA AGOE - 09/01/2026 15:30",
      "conteudo": null,
      "url": "https://sistemasweb.b3.com.br/PlantaoNoticias/Noticias/Detail?idNoticia=3195252&agencia=18&dataNoticia=2026-01-06%2019:32:33",
      "id": 3195252,
      "categoria": "Governança"
    },
    {
      "data": "2026-01-06",
      "data_hora": "2026-01-06 19:30:55",
      "titulo": " 09/01/2026 15:00",
      "headline": "ECO SEC AGRO (ECOA) CRA E:366 S:1(s) PROPOSTA AGOE - 09/01/2026 15:00",
      "conteudo": null,
      "url": "https://sistemasweb.b3.com.br/PlantaoNoticias/Noticias/Detail?idNoticia=3195250&agencia=18&dataNoticia=2026-01-06%2019:30:55",
      "id": 3195250,
      "categoria": "Governança"
    },
    {
      "data": "2026-01-06",
      "data_hora": "2026-01-06 19:29:29",
      "titulo": " 09/01/2026 14:15",
      "headline": "ECO SEC AGRO (ECOA) CRA E:349 S:1 PROPOSTA AGOE - 09/01/2026 14:15",
      "conteudo": null,
      "url": "https://sistemasweb.b3.com.br/PlantaoNoticias/Noticias/Detail?idNoticia=3195248&agencia=18&dataNoticia=2026-01-06%2019:29:29",
      "id": 3195248,
      "categoria": "Governança"
    },
    {
      "data": "2026-01-06",
      "data_hora": "2026-01-06 19:27:39",
      "titulo": " 09/01/2026 14:30",
      "headline": "ECO SEC AGRO (ECOA) CRA E:348 S:1(s) PROPOSTA AGOE - 09/01/2026 14:30",
      "conteudo": null,
      "url": "https://sistemasweb.b3.com.br/PlantaoNoticias/Noticias/Detail?idNoticia=3195246&agencia=18&dataNoticia=2026-01-06%2019:27:39",
      "id": 3195246,
      "categoria": "Governança"
    },
    {
      "data": "2026-01-06",
      "data_hora": "2026-01-06 19:26:04",
      "titulo": " 09/01/2025 14:45",
      "headline": "ECO SEC AGRO (ECOA) CRA E:344 S:1(s) PROPOSTA AGOE - 09/01/2025 14:45",
      "conteudo": null,
      "url": "https://sistemasweb.b3.com.br/PlantaoNoticias/Noticias/Detail?idNoticia=3195245&agencia=18&dataNoticia=2026-01-06%2019:26:04",
      "id": 3195245,
      "categoria": "Governança"
    },
    {
      "data": "2026-01-06",
      "data_hora": "2026-01-06 19:23:37",
      "titulo": " 09/01/2026 14:00",
      "headline": "ECO SEC AGRO (ECOA) CRA E:343 S:1 PROPOSTA AGOE - 09/01/2026 14:00",
      "conteudo": null,
      "url": "https://sistemasweb.b3.com.br/PlantaoNoticias/Noticias/Detail?idNoticia=3195244&agencia=18&dataNoticia=2026-01-06%2019:23:37",
      "id": 3195244,
      "categoria": "Governança"
    },
    {
      "data": "2026-01-06",
      "data_hora": "2026-01-06 19:22:05",
      "titulo": " 08/01/2026 16:00",
      "headline": "ECO SEC AGRO (ECOA) CRA E:327 S:1(s) PROPOSTA AGOE - 08/01/2026 16:00",
      "conteudo": null,
      "url": "https://sistemasweb.b3.com.br/PlantaoNoticias/Noticias/Detail?idNoticia=3195243&agencia=18&dataNoticia=2026-01-06%2019:22:05",
      "id": 3195243,
      "categoria": "Governança"
    },
    {
      "data": "2026-01-06",
      "data_hora": "2026-01-06 19:19:48",
      "titulo": " 08/01/2026 15:45",
      "headline": "ECO SEC AGRO (ECOA) CRA E:237 S:1 PROPOSTA AGOE - 08/01/2026 15:45",
      "conteudo": null,
      "url": "https://sistemasweb.b3.com.br/PlantaoNoticias/Noticias/Detail?idNoticia=3195239&agencia=18&dataNoticia=2026-01-06%2019:19:48",
      "id": 3195239,
      "categoria": "Governança"
    },
    {
      "data": "2026-01-06",
      "data_hora": "2026-01-06 19:17:55",
      "titulo": " 08/01/2026 15:30",
      "headline": "ECO SEC AGRO (ECOA) CRA E:166 S:1 PROPOSTA AGOE - 08/01/2026 15:30",
      "conteudo": null,
      "url": "https://sistemasweb.b3.com.br/PlantaoNoticias/Noticias/Detail?idNoticia=3195236&agencia=18&dataNoticia=2026-01-06%2019:17:55",
      "id": 3195236,
      "categoria": "Governança"
    },
    {
      "data": "2026-01-06",
      "data_hora": "2026-01-06 19:13:41",
      "titulo": " 08/01/2026 15:00",
      "headline": "ECO SEC AGRO (ECOA) CRA E:120 S:1(s) PROPOSTA AGOE - 08/01/2026 15:00",
      "conteudo": null,
      "url": "https://sistemasweb.b3.com.br/PlantaoNoticias/Noticias/Detail?idNoticia=3195233&agencia=18&dataNoticia=2026-01-06%2019:13:41",
      "id": 3195233,
      "categoria": "Governança"
    },
    {
      "data": "2026-01-06",
      "data_hora": "2026-01-06 19:10:37",
      "titulo": " 08/01/2025 14:45",
      "headline": "ECO SEC AGRO (ECOA) CRA E:116 S:1 PROPOSTA AGOE - 08/01/2025 14:45",
      "conteudo": null,
      "url": "https://sistemasweb.b3.com.br/PlantaoNoticias/Noticias/Detail?idNoticia=3195229&agencia=18&dataNoticia=2026-01-06%2019:10:37",
      "id": 3195229,
      "categoria": "Governança"
    },
    {
      "data": "2026-01-06",
      "data_hora": "2026-01-06 19:08:25",
      "titulo": " 08/01/2026 15:15",
      "headline": "ECO SEC AGRO (ECOA) CRA E:106 S:1(s) PROPOSTA AGOE - 08/01/2026 15:15",
      "conteudo": null,
      "url": "https://sistemasweb.b3.com.br/PlantaoNoticias/Noticias/Detail?idNoticia=3195226&agencia=18&dataNoticia=2026-01-06%2019:08:25",
      "id": 3195226,
      "categoria": "Governança"
    },
    {
      "data": "2026-01-06",
      "data_hora": "2026-01-06 19:06:24",
      "titulo": " 08/01/2026 14:00",
      "headline": "ECO SEC AGRO (ECOA) CRA E:1 S:102(s) PROPOSTA AGOE - 08/01/2026 14:00",
      "conteudo": null,
      "url": "https://sistemasweb.b3.com.br/PlantaoNoticias/Noticias/Detail?idNoticia=3195225&agencia=18&dataNoticia=2026-01-06%2019:06:24",
      "id": 3195225,
      "categoria": "Governança"
    },
    {
      "data": "2026-01-06",
      "data_hora": "2026-01-06 19:04:17",
      "titulo": " 08/01/2026 14:30",
      "headline": "ECO SEC AGRO (ECOA) CRA E:84 S:1 PROPOSTA AGOE - 08/01/2026 14:30",
      "conteudo": null,
      "url": "https://sistemasweb.b3.com.br/PlantaoNoticias/Noticias/Detail?idNoticia=3195167&agencia=18&dataNoticia=2026-01-06%2019:04:17",
      "id": 3195167,
      "categoria": "Governança"
    },
    {
      "data": "2026-01-06",
      "data_hora": "2026-01-06 19:01:49",
      "titulo": " 08/01/2026 14:15",
      "headline": "ECO SEC AGRO (ECOA) CRA E:75 S:1(s) PROPOSTA AGOE - 08/01/2026 14:15",
      "conteudo": null,
      "url": "https://sistemasweb.b3.com.br/PlantaoNoticias/Noticias/Detail?idNoticia=3195118&agencia=18&dataNoticia=2026-01-06%2019:01:49",
      "id": 3195118,
      "categoria": "Governança"
    },
    {
      "data": "2026-01-06",
      "data_hora": "2026-01-06 18:59:29",
      "titulo": " 09/01/2026 15:15",
      "headline": "ECO SEC AGRO (ECOA) CRA E:345 S:1(s) PROPOSTA AGOE - 09/01/2026 15:15",
      "conteudo": null,
      "url": "https://sistemasweb.b3.com.br/PlantaoNoticias/Noticias/Detail?idNoticia=3195114&agencia=18&dataNoticia=2026-01-06%2018:59:29",
      "id": 3195114,
      "categoria": "Governança"
    },
    {
      "data": "2026-01-06",
      "data_hora": "2026-01-06 18:02:52",
      "titulo": " 28/01/2025 14:30",
      "headline": "ECO SEC AGRO (ECOA) CRA E:394 S:1 EDITAL AGOE - 28/01/2025 14:30",
      "conteudo": null,
      "url": "https://sistemasweb.b3.com.br/PlantaoNoticias/Noticias/Detail?idNoticia=3194829&agencia=18&dataNoticia=2026-01-06%2018:02:52",
      "id": 3194829,
      "categoria": "Governança"
    },
    {
      "data": "2026-01-06",
      "data_hora": "2026-01-06 15:52:55",
      "titulo": " 06/01/2026 15:30",
      "headline": "ECO SEC AGRO (ECOA) CRA E:378 S:1(s) ATA AGOE - 06/01/2026 15:30",
      "conteudo": null,
      "url": "https://sistemasweb.b3.com.br/PlantaoNoticias/Noticias/Detail?idNoticia=3194533&agencia=18&dataNoticia=2026-01-06%2015:52:55",
      "id": 3194533,
      "categoria": "Governança"
    },
    {
      "data": "2026-01-06",
      "data_hora": "2026-01-06 15:50:10",
      "titulo": " 06/01/2026 15:15",
      "headline": "ECO SEC AGRO (ECOA) CRI E:3 S:1 ATA AGOE - 06/01/2026 15:15",
      "conteudo": null,
      "url": "https://sistemasweb.b3.com.br/PlantaoNoticias/Noticias/Detail?idNoticia=3194529&agencia=18&dataNoticia=2026-01-06%2015:50:10",
      "id": 3194529,
      "categoria": "Governança"
    },
    {
      "data": "2026-01-06",
      "data_hora": "2026-01-06 15:48:55",
      "titulo": " 06/01/2026 15:00",
      "headline": "ECO SEC AGRO (ECOA) CRA E:314 S:1(s) ATA AGOE - 06/01/2026 15:00",
      "conteudo": null,
      "url": "https://sistemasweb.b3.com.br/PlantaoNoticias/Noticias/Detail?idNoticia=3194528&agencia=18&dataNoticia=2026-01-06%2015:48:55",
      "id": 3194528,
      "categoria": "Governança"
    },
    {
      "data": "2026-01-06",
      "data_hora": "2026-01-06 15:47:23",
      "titulo": " 06/01/2026 14:45",
      "headline": "ECO SEC AGRO (ECOA) CRA E:295 S:1(s) ATA AGOE - 06/01/2026 14:45",
      "conteudo": null,
      "url": "https://sistemasweb.b3.com.br/PlantaoNoticias/Noticias/Detail?idNoticia=3194526&agencia=18&dataNoticia=2026-01-06%2015:47:23",
      "id": 3194526,
      "categoria": "Governança"
    },
    {
      "data": "2026-01-06",
      "data_hora": "2026-01-06 15:46:03",
      "titulo": " 06/01/2025 14:30",
      "headline": "ECO SEC AGRO (ECOA) CRA E:352 S:1 ATA AGOE - 06/01/2025 14:30",
      "conteudo": null,
      "url": "https://sistemasweb.b3.com.br/PlantaoNoticias/Noticias/Detail?idNoticia=3194523&agencia=18&dataNoticia=2026-01-06%2015:46:03",
      "id": 3194523,
      "categoria": "Governança"
    },
    {
      "data": "2026-01-06",
      "data_hora": "2026-01-06 15:43:54",
      "titulo": " 06/01/2026 14:15",
      "headline": "ECO SEC AGRO (ECOA) CRA E:328 S:1 ATA AGOE - 06/01/2026 14:15",
      "conteudo": null,
      "url": "https://sistemasweb.b3.com.br/PlantaoNoticias/Noticias/Detail?idNoticia=3194519&agencia=18&dataNoticia=2026-01-06%2015:43:54",
      "id": 3194519,
      "categoria": "Governança"
    },
    {
      "data": "2026-01-06",
      "data_hora": "2026-01-06 13:54:11",
      "titulo": " 06/01/2026",
      "headline": "ECO SEC AGRO (ECOA) CRA E:131 S:1(s) Comunicado ao mercado - 06/01/2026",
      "conteudo": null,
      "url": "https://sistemasweb.b3.com.br/PlantaoNoticias/Noticias/Detail?idNoticia=3194309&agencia=18&dataNoticia=2026-01-06%2013:54:11",
      "id": 3194309,
      "categoria": "Aviso"
    },
    {
      "data": "2026-01-06",
      "data_hora": "2026-01-06 13:42:30",
      "titulo": " 06/01/2026 12:00",
      "headline": "ECO SEC AGRO (ECOA) CRA E:323 S:1 ATA AGOE - 06/01/2026 12:00",
      "conteudo": null,
      "url": "https://sistemasweb.b3.com.br/PlantaoNoticias/Noticias/Detail?idNoticia=3194287&agencia=18&dataNoticia=2026-01-06%2013:42:30",
      "id": 3194287,
      "categoria": "Governança"
    },
    {
      "data": "2026-01-06",
      "data_hora": "2026-01-06 13:38:00",
      "titulo": " 06/01/2026 11:15",
      "headline": "ECO SEC AGRO (ECOA) CRA E:321 S:1(s) ATA AGOE - 06/01/2026 11:15",
      "conteudo": null,
      "url": "https://sistemasweb.b3.com.br/PlantaoNoticias/Noticias/Detail?idNoticia=3194279&agencia=18&dataNoticia=2026-01-06%2013:38:00",
      "id": 3194279,
      "categoria": "Governança"
    },
    {
      "data": "2026-01-06",
      "data_hora": "2026-01-06 13:36:18",
      "titulo": " 06/01/2026 11:00",
      "headline": "ECO SEC AGRO (ECOA) CRA E:322 S:1 ATA AGOE - 06/01/2026 11:00",
      "conteudo": null,
      "url": "https://sistemasweb.b3.com.br/PlantaoNoticias/Noticias/Detail?idNoticia=3194277&agencia=18&dataNoticia=2026-01-06%2013:36:18",
      "id": 3194277,
      "categoria": "Governança"
    },
    {
      "data": "2026-01-06",
      "data_hora": "2026-01-06 13:34:17",
      "titulo": " 06/01/2026 10:45",
      "headline": "ECO SEC AGRO (ECOA) CRA E:326 S:1 ATA AGOE - 06/01/2026 10:45",
      "conteudo": null,
      "url": "https://sistemasweb.b3.com.br/PlantaoNoticias/Noticias/Detail?idNoticia=3194276&agencia=18&dataNoticia=2026-01-06%2013:34:17",
      "id": 3194276,
      "categoria": "Governança"
    },
    {
      "data": "2026-01-06",
      "data_hora": "2026-01-06 13:32:25",
      "titulo": " 06/01/2026 10:30",
      "headline": "ECO SEC AGRO (ECOA) CRA E:319 S:1(s) ATA AGOE - 06/01/2026 10:30",
      "conteudo": null,
      "url": "https://sistemasweb.b3.com.br/PlantaoNoticias/Noticias/Detail?idNoticia=3194274&agencia=18&dataNoticia=2026-01-06%2013:32:25",
      "id": 3194274,
      "categoria": "Governança"
    },
    {
      "data": "2026-01-06",
      "data_hora": "2026-01-06 13:30:11",
      "titulo": " 06/01/2026 10:15",
      "headline": "ECO SEC AGRO (ECOA) CRA E:315 S:1(s) ATA AGOE - 06/01/2026 10:15",
      "conteudo": null,
      "url": "https://sistemasweb.b3.com.br/PlantaoNoticias/Noticias/Detail?idNoticia=3194272&agencia=18&dataNoticia=2026-01-06%2013:30:11",
      "id": 3194272,
      "categoria": "Governança"
    },
    {
      "data": "2026-01-06",
      "data_hora": "2026-01-06 13:09:12",
      "titulo": " 06/01/2026 10:00",
      "headline": "ECO SEC AGRO (ECOA) CRA E:301 S:1(s) ATA AGOE - 06/01/2026 10:00",
      "conteudo": null,
      "url": "https://sistemasweb.b3.com.br/PlantaoNoticias/Noticias/Detail?idNoticia=3194250&agencia=18&dataNoticia=2026-01-06%2013:09:12",
      "id": 3194250,
      "categoria": "Governança"
    },
    {
      "data": "2026-01-06",
      "data_hora": "2026-01-06 10:35:14",
      "titulo": " 05/01/2026 11:30 (R)",
      "headline": "ECO SEC AGRO (ECOA) CRA E:221 S:1 ATA AGOE - 05/01/2026 11:30 (R)",
      "conteudo": null,
      "url": "https://sistemasweb.b3.com.br/PlantaoNoticias/Noticias/Detail?idNoticia=3194089&agencia=18&dataNoticia=2026-01-06%2010:35:14",
      "id": 3194089,
      "categoria": "Governança"
    },
    {
      "data": "2026-01-06",
      "data_hora": "2026-01-06 10:32:39",
      "titulo": " 05/01/2026 11:15 (R)",
      "headline": "ECO SEC AGRO (ECOA) CRA E:196 S:1(s) ATA AGOE - 05/01/2026 11:15 (R)",
      "conteudo": null,
      "url": "https://sistemasweb.b3.com.br/PlantaoNoticias/Noticias/Detail?idNoticia=3194087&agencia=18&dataNoticia=2026-01-06%2010:32:39",
      "id": 3194087,
      "categoria": "Governança"
    },
    {
      "data": "2026-01-06",
      "data_hora": "2026-01-06 10:30:29",
      "titulo": " 05/01/2026 11:00 (R)",
      "headline": "ECO SEC AGRO (ECOA) CRA E:208 S:1 ATA AGOE - 05/01/2026 11:00 (R)",
      "conteudo": null,
      "url": "https://sistemasweb.b3.com.br/PlantaoNoticias/Noticias/Detail?idNoticia=3194085&agencia=18&dataNoticia=2026-01-06%2010:30:29",
      "id": 3194085,
      "categoria": "Governança"
    },
    {
      "data": "2026-01-06",
      "data_hora": "2026-01-06 10:28:53",
      "titulo": " 05/01/2026 10:45 (R)",
      "headline": "ECO SEC AGRO (ECOA) CRA E:207 S:1 ATA AGOE - 05/01/2026 10:45 (R)",
      "conteudo": null,
      "url": "https://sistemasweb.b3.com.br/PlantaoNoticias/Noticias/Detail?idNoticia=3194083&agencia=18&dataNoticia=2026-01-06%2010:28:53",
      "id": 3194083,
      "categoria": "Governança"
    },
    {
      "data": "2026-01-06",
      "data_hora": "2026-01-06 10:26:54",
      "titulo": " 05/01/2026 10:30 (R)",
      "headline": "ECO SEC AGRO (ECOA) CRA E:209 S:1 ATA AGOE - 05/01/2026 10:30 (R)",
      "conteudo": null,
      "url": "https://sistemasweb.b3.com.br/PlantaoNoticias/Noticias/Detail?idNoticia=3194080&agencia=18&dataNoticia=2026-01-06%2010:26:54",
      "id": 3194080,
      "categoria": "Governança"
    },
    {
      "data": "2026-01-06",
      "data_hora": "2026-01-06 10:18:31",
      "titulo": " 05/01/2026 10:15 (R)",
      "headline": "ECO SEC AGRO (ECOA) CRA E:155 S:1(s) ATA AGOE - 05/01/2026 10:15 (R)",
      "conteudo": null,
      "url": "https://sistemasweb.b3.com.br/PlantaoNoticias/Noticias/Detail?idNoticia=3194072&agencia=18&dataNoticia=2026-01-06%2010:18:31",
      "id": 3194072,
      "categoria": "Governança"
    },
    {
      "data": "2026-01-06",
      "data_hora": "2026-01-06 09:16:30",
      "titulo": " 14/01/2026 11:00",
      "headline": "ECO SEC AGRO (ECOA) CRA E:137 S:1(s) EDITAL AGOE - 14/01/2026 11:00",
      "conteudo": null,
      "url": "https://sistemasweb.b3.com.br/PlantaoNoticias/Noticias/Detail?idNoticia=3193905&agencia=18&dataNoticia=2026-01-06%2009:16:30",
      "id": 3193905,
      "categoria": "Governança"
    },
    {
      "data": "2026-01-05",
      "data_hora": "2026-01-05 18:05:24",
      "titulo": " 25/01/2026 10:00",
      "headline": "ECO SEC AGRO (ECOA) CRA E:295 S:1(s) EDITAL AGOE - 25/01/2026 10:00",
      "conteudo": null,
      "url": "https://sistemasweb.b3.com.br/PlantaoNoticias/Noticias/Detail?idNoticia=3193358&agencia=18&dataNoticia=2026-01-05%2018:05:24",
      "id": 3193358,
      "categoria": "Governança"
    },
    {
      "data": "2026-01-05",
      "data_hora": "2026-01-05 17:10:20",
      "titulo": " 05/01/2026 12:00",
      "headline": "ECO SEC AGRO (ECOA) CRA E:216 S:1(s) ATA AGOE - 05/01/2026 12:00",
      "conteudo": null,
      "url": "https://sistemasweb.b3.com.br/PlantaoNoticias/Noticias/Detail?idNoticia=3193105&agencia=18&dataNoticia=2026-01-05%2017:10:20",
      "id": 3193105,
      "categoria": "Governança"
    },
    {
      "data": "2026-01-05",
      "data_hora": "2026-01-05 17:09:08",
      "titulo": " 05/01/2026 11:45",
      "headline": "ECO SEC AGRO (ECOA) CRA E:222 S:1 ATA AGOE - 05/01/2026 11:45",
      "conteudo": null,
      "url": "https://sistemasweb.b3.com.br/PlantaoNoticias/Noticias/Detail?idNoticia=3193104&agencia=18&dataNoticia=2026-01-05%2017:09:08",
      "id": 3193104,
      "categoria": "Governança"
    },
    {
      "data": "2026-01-05",
      "data_hora": "2026-01-05 17:07:58",
      "titulo": " 05/01/2026 11:30",
      "headline": "ECO SEC AGRO (ECOA) CRA E:221 S:1 ATA AGOE - 05/01/2026 11:30",
      "conteudo": null,
      "url": "https://sistemasweb.b3.com.br/PlantaoNoticias/Noticias/Detail?idNoticia=3193103&agencia=18&dataNoticia=2026-01-05%2017:07:58",
      "id": 3193103,
      "categoria": "Governança"
    },
    {
      "data": "2026-01-05",
      "data_hora": "2026-01-05 17:07:29",
      "titulo": " 05/01/2026 16:00",
      "headline": "ECO SEC AGRO (ECOA) CRA E:259 S:1(s) ATA AGOE - 05/01/2026 16:00",
      "conteudo": null,
      "url": "https://sistemasweb.b3.com.br/PlantaoNoticias/Noticias/Detail?idNoticia=3193102&agencia=18&dataNoticia=2026-01-05%2017:07:29",
      "id": 3193102,
      "categoria": "Governança"
    },
    {
      "data": "2026-01-05",
      "data_hora": "2026-01-05 17:06:50",
      "titulo": " 05/01/2026 11:15",
      "headline": "ECO SEC AGRO (ECOA) CRA E:196 S:1(s) ATA AGOE - 05/01/2026 11:15",
      "conteudo": null,
      "url": "https://sistemasweb.b3.com.br/PlantaoNoticias/Noticias/Detail?idNoticia=3193100&agencia=18&dataNoticia=2026-01-05%2017:06:50",
      "id": 3193100,
      "categoria": "Governança"
    },
    {
      "data": "2026-01-05",
      "data_hora": "2026-01-05 17:06:14",
      "titulo": " 05/01/2026 15:45",
      "headline": "ECO SEC AGRO (ECOA) CRA E:234 S:1(s) ATA AGOE - 05/01/2026 15:45",
      "conteudo": null,
      "url": "https://sistemasweb.b3.com.br/PlantaoNoticias/Noticias/Detail?idNoticia=3193097&agencia=18&dataNoticia=2026-01-05%2017:06:14",
      "id": 3193097,
      "categoria": "Governança"
    },
    {
      "data": "2026-01-05",
      "data_hora": "2026-01-05 17:05:18",
      "titulo": " 05/01/2026 11:00",
      "headline": "ECO SEC AGRO (ECOA) CRA E:208 S:1 ATA AGOE - 05/01/2026 11:00",
      "conteudo": null,
      "url": "https://sistemasweb.b3.com.br/PlantaoNoticias/Noticias/Detail?idNoticia=3193096&agencia=18&dataNoticia=2026-01-05%2017:05:18",
      "id": 3193096,
      "categoria": "Governança"
    },
    {
      "data": "2026-01-05",
      "data_hora": "2026-01-05 17:04:27",
      "titulo": " 05/01/2026 15:30",
      "headline": "ECO SEC AGRO (ECOA) CRA E:225 S:1 ATA AGOE - 05/01/2026 15:30",
      "conteudo": null,
      "url": "https://sistemasweb.b3.com.br/PlantaoNoticias/Noticias/Detail?idNoticia=3193094&agencia=18&dataNoticia=2026-01-05%2017:04:27",
      "id": 3193094,
      "categoria": "Governança"
    },
    {
      "data": "2026-01-05",
      "data_hora": "2026-01-05 17:03:58",
      "titulo": " 05/01/2026 10:45",
      "headline": "ECO SEC AGRO (ECOA) CRA E:207 S:1 ATA AGOE - 05/01/2026 10:45",
      "conteudo": null,
      "url": "https://sistemasweb.b3.com.br/PlantaoNoticias/Noticias/Detail?idNoticia=3193093&agencia=18&dataNoticia=2026-01-05%2017:03:58",
      "id": 3193093,
      "categoria": "Governança"
    },
    {
      "data": "2026-01-05",
      "data_hora": "2026-01-05 17:01:48",
      "titulo": " 05/01/2026 15:15",
      "headline": "ECO SEC AGRO (ECOA) CRA E:227 S:1(s) ATA AGOE - 05/01/2026 15:15",
      "conteudo": null,
      "url": "https://sistemasweb.b3.com.br/PlantaoNoticias/Noticias/Detail?idNoticia=3193049&agencia=18&dataNoticia=2026-01-05%2017:01:48",
      "id": 3193049,
      "categoria": "Governança"
    },
    {
      "data": "2026-01-05",
      "data_hora": "2026-01-05 17:01:32",
      "titulo": " 05/01/2026 10:30",
      "headline": "ECO SEC AGRO (ECOA) CRA E:209 S:1 ATA AGOE - 05/01/2026 10:30",
      "conteudo": null,
      "url": "https://sistemasweb.b3.com.br/PlantaoNoticias/Noticias/Detail?idNoticia=3193048&agencia=18&dataNoticia=2026-01-05%2017:01:32",
      "id": 3193048,
      "categoria": "Governança"
    },
    {
      "data": "2026-01-05",
      "data_hora": "2026-01-05 17:00:05",
      "titulo": " 05/01/2026 15:00",
      "headline": "ECO SEC AGRO (ECOA) CRA E:224 S:1 ATA AGOE - 05/01/2026 15:00",
      "conteudo": null,
      "url": "https://sistemasweb.b3.com.br/PlantaoNoticias/Noticias/Detail?idNoticia=3193046&agencia=18&dataNoticia=2026-01-05%2017:00:05",
      "id": 3193046,
      "categoria": "Governança"
    },
    {
      "data": "2026-01-05",
      "data_hora": "2026-01-05 16:59:43",
      "titulo": " 05/01/2026 10:45",
      "headline": "ECO SEC AGRO (ECOA) CRA E:200 S:1 ATA AGOE - 05/01/2026 10:45",
      "conteudo": null,
      "url": "https://sistemasweb.b3.com.br/PlantaoNoticias/Noticias/Detail?idNoticia=3193045&agencia=18&dataNoticia=2026-01-05%2016:59:43",
      "id": 3193045,
      "categoria": "Governança"
    },
    {
      "data": "2026-01-05",
      "data_hora": "2026-01-05 16:57:37",
      "titulo": " 05/01/2026 10:15",
      "headline": "ECO SEC AGRO (ECOA) CRA E:155 S:1(s) ATA AGOE - 05/01/2026 10:15",
      "conteudo": null,
      "url": "https://sistemasweb.b3.com.br/PlantaoNoticias/Noticias/Detail?idNoticia=3193044&agencia=18&dataNoticia=2026-01-05%2016:57:37",
      "id": 3193044,
      "categoria": "Governança"
    },
    {
      "data": "2026-01-05",
      "data_hora": "2026-01-05 16:57:08",
      "titulo": " 05/01/2026 14:45",
      "headline": "ECO SEC AGRO (ECOA) CRA E:228 S:1 ATA AGOE - 05/01/2026 14:45",
      "conteudo": null,
      "url": "https://sistemasweb.b3.com.br/PlantaoNoticias/Noticias/Detail?idNoticia=3193042&agencia=18&dataNoticia=2026-01-05%2016:57:08",
      "id": 3193042,
      "categoria": "Governança"
    },
    {
      "data": "2026-01-05",
      "data_hora": "2026-01-05 16:54:49",
      "titulo": " 05/01/2026 14:30",
      "headline": "ECO SEC AGRO (ECOA) CRA E:239 S:1 ATA AGOE - 05/01/2026 14:30",
      "conteudo": null,
      "url": "https://sistemasweb.b3.com.br/PlantaoNoticias/Noticias/Detail?idNoticia=3193037&agencia=18&dataNoticia=2026-01-05%2016:54:49",
      "id": 3193037,
      "categoria": "Governança"
    },
    {
      "data": "2026-01-05",
      "data_hora": "2026-01-05 16:46:27",
      "titulo": " 05/01/2026 14:15",
      "headline": "ECO SEC AGRO (ECOA) CRA E:231 S:1(s) ATA AGOE - 05/01/2026 14:15",
      "conteudo": null,
      "url": "https://sistemasweb.b3.com.br/PlantaoNoticias/Noticias/Detail?idNoticia=3193017&agencia=18&dataNoticia=2026-01-05%2016:46:27",
      "id": 3193017,
      "categoria": "Governança"
    },
    {
      "data": "2026-01-05",
      "data_hora": "2026-01-05 16:44:38",
      "titulo": " 05/01/2026 14:00",
      "headline": "ECO SEC AGRO (ECOA) CRI E:1 S:1 ATA AGOE - 05/01/2026 14:00",
      "conteudo": null,
      "url": "https://sistemasweb.b3.com.br/PlantaoNoticias/Noticias/Detail?idNoticia=3193013&agencia=18&dataNoticia=2026-01-05%2016:44:38",
      "id": 3193013,
      "categoria": "Governança"
    },
    {
      "data": "2026-01-05",
      "data_hora": "2026-01-05 16:29:02",
      "titulo": " 05/01/2026 10:00",
      "headline": "ECO SEC AGRO (ECOA) CRA E:140 S:1(s) ATA AGOE - 05/01/2026 10:00",
      "conteudo": null,
      "url": "https://sistemasweb.b3.com.br/PlantaoNoticias/Noticias/Detail?idNoticia=3193000&agencia=18&dataNoticia=2026-01-05%2016:29:02",
      "id": 3193000,
      "categoria": "Governança"
    },
    {
      "data": "2026-01-05",
      "data_hora": "2026-01-05 14:12:11",
      "titulo": " 05/01/2026",
      "headline": "ECO SEC AGRO (ECOA) CRA E:185 S:1(s) FATO RELEVANTE - 05/01/2026",
      "conteudo": null,
      "url": "https://sistemasweb.b3.com.br/PlantaoNoticias/Noticias/Detail?idNoticia=3192772&agencia=18&dataNoticia=2026-01-05%2014:12:11",
      "id": 3192772,
      "categoria": "Fato Relevante"
    },
    {
      "data": "2026-01-05",
      "data_hora": "2026-01-05 08:14:30",
      "titulo": " 02/01/2026",
      "headline": "ECO SEC AGRO (ECOA) CRA E:190 S:1 FATO RELEVANTE - 02/01/2026",
      "conteudo": null,
      "url": "https://sistemasweb.b3.com.br/PlantaoNoticias/Noticias/Detail?idNoticia=3192198&agencia=18&dataNoticia=2026-01-05%2008:14:30",
      "id": 3192198,
      "categoria": "Fato Relevante"
    },
    {
      "data": "2026-01-05",
      "data_hora": "2026-01-05 08:14:29",
      "titulo": " 02/01/2026",
      "headline": "ECO SEC AGRO (ECOA) CRA E:185 S:1(s) FATO RELEVANTE - 02/01/2026",
      "conteudo": null,
      "url": "https://sistemasweb.b3.com.br/PlantaoNoticias/Noticias/Detail?idNoticia=3192197&agencia=18&dataNoticia=2026-01-05%2008:14:29",
      "id": 3192197,
      "categoria": "Fato Relevante"
    },
    {
      "data": "2026-01-02",
      "data_hora": "2026-01-02 16:08:54",
      "titulo": " 29/01/2026 11:00",
      "headline": "ECO SEC AGRO (ECOA) CRA E:185 S:1(s) EDITAL AGOE - 29/01/2026 11:00",
      "conteudo": null,
      "url": "https://sistemasweb.b3.com.br/PlantaoNoticias/Noticias/Detail?idNoticia=3191446&agencia=18&dataNoticia=2026-01-02%2016:08:54",
      "id": 3191446,
      "categoria": "Governança"
    },
    {
      "data": "2026-01-02",
      "data_hora": "2026-01-02 16:08:02",
      "titulo": " 30/01/2026 11:00",
      "headline": "ECO SEC AGRO (ECOA) CRA E:190 S:1 EDITAL AGOE - 30/01/2026 11:00",
      "conteudo": null,
      "url": "https://sistemasweb.b3.com.br/PlantaoNoticias/Noticias/Detail?idNoticia=3191443&agencia=18&dataNoticia=2026-01-02%2016:08:02",
      "id": 3191443,
      "categoria": "Governança"
    },
    {
      "data": "2026-01-02",
      "data_hora": "2026-01-02 08:14:20",
      "titulo": " 31/12/2025",
      "headline": "ECO SEC AGRO (ECOA) CRA E:260 S:1(s) Comunicado ao mercado - 31/12/2025",
      "conteudo": null,
      "url": "https://sistemasweb.b3.com.br/PlantaoNoticias/Noticias/Detail?idNoticia=3190083&agencia=18&dataNoticia=2026-01-02%2008:14:20",
      "id": 3190083,
      "categoria": "Aviso"
    },
    {
      "data": "2026-01-02",
      "data_hora": "2026-01-02 08:14:20",
      "titulo": " 31/12/2025",
      "headline": "ECO SEC AGRO (ECOA) CRA E:190 S:1 Comunicado ao mercado - 31/12/2025",
      "conteudo": null,
      "url": "https://sistemasweb.b3.com.br/PlantaoNoticias/Noticias/Detail?idNoticia=3190084&agencia=18&dataNoticia=2026-01-02%2008:14:20",
      "id": 3190084,
      "categoria": "Aviso"
    },
    {
      "data": "2026-01-02",
      "data_hora": "2026-01-02 08:14:15",
      "titulo": " 31/12/2025 10:00",
      "headline": "ECO SEC AGRO (ECOA) CRA E:145 S:1(s) ATA AGOE - 31/12/2025 10:00",
      "conteudo": null,
      "url": "https://sistemasweb.b3.com.br/PlantaoNoticias/Noticias/Detail?idNoticia=3190043&agencia=18&dataNoticia=2026-01-02%2008:14:15",
      "id": 3190043,
      "categoria": "Governança"
    },
    {
      "data": "2026-01-02",
      "data_hora": "2026-01-02 08:13:40",
      "titulo": " 30/09/2025",
      "headline": "ECO SEC AGRO (ECOA) CRA E:252 S:1(s) DEMONST. FINANC. - 30/09/2025",
      "conteudo": null,
      "url": "https://sistemasweb.b3.com.br/PlantaoNoticias/Noticias/Detail?idNoticia=3189793&agencia=18&dataNoticia=2026-01-02%2008:13:40",
      "id": 3189793,
      "categoria": "Outros"
    },
    {
      "data": "2026-01-02",
      "data_hora": "2026-01-02 08:13:40",
      "titulo": " 30/09/2025",
      "headline": "ECO SEC AGRO (ECOA) CRA E:169 S:1(s) DEMONST. FINANC. - 30/09/2025",
      "conteudo": null,
      "url": "https://sistemasweb.b3.com.br/PlantaoNoticias/Noticias/Detail?idNoticia=3189795&agencia=18&dataNoticia=2026-01-02%2008:13:40",
      "id": 3189795,
      "categoria": "Outros"
    },
    {
      "data": "2026-01-02",
      "data_hora": "2026-01-02 08:13:40",
      "titulo": " 30/09/2025",
      "headline": "ECO SEC AGRO (ECOA) CRA E:11 S:1(s) DEMONST. FINANC. - 30/09/2025",
      "conteudo": null,
      "url": "https://sistemasweb.b3.com.br/PlantaoNoticias/Noticias/Detail?idNoticia=3189797&agencia=18&dataNoticia=2026-01-02%2008:13:40",
      "id": 3189797,
      "categoria": "Outros"
    },
    {
      "data": "2026-01-02",
      "data_hora": "2026-01-02 08:13:39",
      "titulo": " 30/09/2025",
      "headline": "ECO SEC AGRO (ECOA) CRA E:72 S:1 DEMONST. FINANC. - 30/09/2025",
      "conteudo": null,
      "url": "https://sistemasweb.b3.com.br/PlantaoNoticias/Noticias/Detail?idNoticia=3189787&agencia=18&dataNoticia=2026-01-02%2008:13:39",
      "id": 3189787,
      "categoria": "Outros"
    },
    {
      "data": "2026-01-02",
      "data_hora": "2026-01-02 08:13:39",
      "titulo": " 30/09/2025",
      "headline": "ECO SEC AGRO (ECOA) CRA E:45 S:1(s) DEMONST. FINANC. - 30/09/2025",
      "conteudo": null,
      "url": "https://sistemasweb.b3.com.br/PlantaoNoticias/Noticias/Detail?idNoticia=3189789&agencia=18&dataNoticia=2026-01-02%2008:13:39",
      "id": 3189789,
      "categoria": "Outros"
    },
    {
      "data": "2026-01-02",
      "data_hora": "2026-01-02 08:13:39",
      "titulo": " 30/09/2025",
      "headline": "ECO SEC AGRO (ECOA) CRA E:251 S:1(s) DEMONST. FINANC. - 30/09/2025",
      "conteudo": null,
      "url": "https://sistemasweb.b3.com.br/PlantaoNoticias/Noticias/Detail?idNoticia=3189791&agencia=18&dataNoticia=2026-01-02%2008:13:39",
      "id": 3189791,
      "categoria": "Outros"
    },
    {
      "data": "2026-01-02",
      "data_hora": "2026-01-02 08:13:39",
      "titulo": " 30/09/2025",
      "headline": "ECO SEC AGRO (ECOA) CRA E:254 S:1 DEMONST. FINANC. - 30/09/2025",
      "conteudo": null,
      "url": "https://sistemasweb.b3.com.br/PlantaoNoticias/Noticias/Detail?idNoticia=3189792&agencia=18&dataNoticia=2026-01-02%2008:13:39",
      "id": 3189792,
      "categoria": "Outros"
    },
    {
      "data": "2026-01-02",
      "data_hora": "2026-01-02 08:13:38",
      "titulo": " 30/09/2025",
      "headline": "ECO SEC AGRO (ECOA) CRA E:85 S:1 DEMONST. FINANC. - 30/09/2025",
      "conteudo": null,
      "url": "https://sistemasweb.b3.com.br/PlantaoNoticias/Noticias/Detail?idNoticia=3189780&agencia=18&dataNoticia=2026-01-02%2008:13:38",
      "id": 3189780,
      "categoria": "Outros"
    },
    {
      "data": "2026-01-02",
      "data_hora": "2026-01-02 08:13:38",
      "titulo": " 30/09/2025",
      "headline": "ECO SEC AGRO (ECOA) CRA E:81 S:1 DEMONST. FINANC. - 30/09/2025",
      "conteudo": null,
      "url": "https://sistemasweb.b3.com.br/PlantaoNoticias/Noticias/Detail?idNoticia=3189784&agencia=18&dataNoticia=2026-01-02%2008:13:38",
      "id": 3189784,
      "categoria": "Outros"
    },
    {
      "data": "2026-01-02",
      "data_hora": "2026-01-02 08:13:36",
      "titulo": " 30/09/2025",
      "headline": "ECO SEC AGRO (ECOA) CRA E:105 S:1(s) DEMONST. FINANC. - 30/09/2025",
      "conteudo": null,
      "url": "https://sistemasweb.b3.com.br/PlantaoNoticias/Noticias/Detail?idNoticia=3189762&agencia=18&dataNoticia=2026-01-02%2008:13:36",
      "id": 3189762,
      "categoria": "Outros"
    },
    {
      "data": "2026-01-02",
      "data_hora": "2026-01-02 08:13:36",
      "titulo": " 30/09/2025",
      "headline": "ECO SEC AGRO (ECOA) CRA E:115 S:1 DEMONST. FINANC. - 30/09/2025",
      "conteudo": null,
      "url": "https://sistemasweb.b3.com.br/PlantaoNoticias/Noticias/Detail?idNoticia=3189765&agencia=18&dataNoticia=2026-01-02%2008:13:36",
      "id": 3189765,
      "categoria": "Outros"
    },
    {
      "data": "2026-01-02",
      "data_hora": "2026-01-02 08:13:36",
      "titulo": " 30/09/2025",
      "headline": "ECO SEC AGRO (ECOA) CRA E:94 S:1(s) DEMONST. FINANC. - 30/09/2025",
      "conteudo": null,
      "url": "https://sistemasweb.b3.com.br/PlantaoNoticias/Noticias/Detail?idNoticia=3189768&agencia=18&dataNoticia=2026-01-02%2008:13:36",
      "id": 3189768,
      "categoria": "Outros"
    },
    {
      "data": "2026-01-02",
      "data_hora": "2026-01-02 08:13:35",
      "titulo": " 30/09/2025",
      "headline": "ECO SEC AGRO (ECOA) CRA E:243 S:1(s) DEMONST. FINANC. - 30/09/2025",
      "conteudo": null,
      "url": "https://sistemasweb.b3.com.br/PlantaoNoticias/Noticias/Detail?idNoticia=3189757&agencia=18&dataNoticia=2026-01-02%2008:13:35",
      "id": 3189757,
      "categoria": "Outros"
    },
    {
      "data": "2026-01-02",
      "data_hora": "2026-01-02 08:13:35",
      "titulo": " 30/09/2025",
      "headline": "ECO SEC AGRO (ECOA) CRA E:142 S:1 DEMONST. FINANC. - 30/09/2025",
      "conteudo": null,
      "url": "https://sistemasweb.b3.com.br/PlantaoNoticias/Noticias/Detail?idNoticia=3189759&agencia=18&dataNoticia=2026-01-02%2008:13:35",
      "id": 3189759,
      "categoria": "Outros"
    },
    {
      "data": "2026-01-02",
      "data_hora": "2026-01-02 08:13:35",
      "titulo": " 30/09/2025",
      "headline": "ECO SEC AGRO (ECOA) CRA E:111 S:1 DEMONST. FINANC. - 30/09/2025",
      "conteudo": null,
      "url": "https://sistemasweb.b3.com.br/PlantaoNoticias/Noticias/Detail?idNoticia=3189760&agencia=18&dataNoticia=2026-01-02%2008:13:35",
      "id": 3189760,
      "categoria": "Outros"
    },
    {
      "data": "2025-12-30",
      "data_hora": "2025-12-30 17:45:44",
      "titulo": " 30/09/2025",
      "headline": "ECO SEC AGRO (ECOA) CRA E:287 S:1(s) DEMONST. FINANC. - 30/09/2025",
      "conteudo": null,
      "url": "https://sistemasweb.b3.com.br/PlantaoNoticias/Noticias/Detail?idNoticia=3188770&agencia=18&dataNoticia=2025-12-30%2017:45:44",
      "id": 3188770,
      "categoria": "Outros"
    },
    {
      "data": "2025-12-30",
      "data_hora": "2025-12-30 17:45:08",
      "titulo": " 30/09/2025",
      "headline": "ECO SEC AGRO (ECOA) CRA E:286 S:1(s) DEMONST. FINANC. - 30/09/2025",
      "conteudo": null,
      "url": "https://sistemasweb.b3.com.br/PlantaoNoticias/Noticias/Detail?idNoticia=3188768&agencia=18&dataNoticia=2025-12-30%2017:45:08",
      "id": 3188768,
      "categoria": "Outros"
    },
    {
      "data": "2025-12-30",
      "data_hora": "2025-12-30 17:44:29",
      "titulo": " 30/09/2025",
      "headline": "ECO SEC AGRO (ECOA) CRA E:285 S:1 DEMONST. FINANC. - 30/09/2025",
      "conteudo": null,
      "url": "https://sistemasweb.b3.com.br/PlantaoNoticias/Noticias/Detail?idNoticia=3188765&agencia=18&dataNoticia=2025-12-30%2017:44:29",
      "id": 3188765,
      "categoria": "Outros"
    },
    {
      "data": "2025-12-30",
      "data_hora": "2025-12-30 17:43:47",
      "titulo": " 30/09/2025",
      "headline": "ECO SEC AGRO (ECOA) CRA E:284 S:1 DEMONST. FINANC. - 30/09/2025",
      "conteudo": null,
      "url": "https://sistemasweb.b3.com.br/PlantaoNoticias/Noticias/Detail?idNoticia=3188763&agencia=18&dataNoticia=2025-12-30%2017:43:47",
      "id": 3188763,
      "categoria": "Outros"
    },
    {
      "data": "2025-12-30",
      "data_hora": "2025-12-30 17:43:08",
      "titulo": " 30/09/2025",
      "headline": "ECO SEC AGRO (ECOA) CRA E:283 S:1 DEMONST. FINANC. - 30/09/2025",
      "conteudo": null,
      "url": "https://sistemasweb.b3.com.br/PlantaoNoticias/Noticias/Detail?idNoticia=3188760&agencia=18&dataNoticia=2025-12-30%2017:43:08",
      "id": 3188760,
      "categoria": "Outros"
    },
    {
      "data": "2025-12-30",
      "data_hora": "2025-12-30 17:42:29",
      "titulo": " 30/09/2025",
      "headline": "ECO SEC AGRO (ECOA) CRA E:281 S:1(s) DEMONST. FINANC. - 30/09/2025",
      "conteudo": null,
      "url": "https://sistemasweb.b3.com.br/PlantaoNoticias/Noticias/Detail?idNoticia=3188758&agencia=18&dataNoticia=2025-12-30%2017:42:29",
      "id": 3188758,
      "categoria": "Outros"
    },
    {
      "data": "2025-12-30",
      "data_hora": "2025-12-30 17:41:50",
      "titulo": " 30/09/2025",
      "headline": "ECO SEC AGRO (ECOA) CRA E:279 S:1(s) DEMONST. FINANC. - 30/09/2025",
      "conteudo": null,
      "url": "https://sistemasweb.b3.com.br/PlantaoNoticias/Noticias/Detail?idNoticia=3188755&agencia=18&dataNoticia=2025-12-30%2017:41:50",
      "id": 3188755,
      "categoria": "Outros"
    },
    {
      "data": "2025-12-30",
      "data_hora": "2025-12-30 17:41:01",
      "titulo": " 30/09/2025",
      "headline": "ECO SEC AGRO (ECOA) CRA E:276 S:1(s) DEMONST. FINANC. - 30/09/2025",
      "conteudo": null,
      "url": "https://sistemasweb.b3.com.br/PlantaoNoticias/Noticias/Detail?idNoticia=3188751&agencia=18&dataNoticia=2025-12-30%2017:41:01",
      "id": 3188751,
      "categoria": "Outros"
    },
    {
      "data": "2025-12-30",
      "data_hora": "2025-12-30 17:38:27",
      "titulo": " 30/09/2025",
      "headline": "ECO SEC AGRO (ECOA) CRA E:275 S:1(s) DEMONST. FINANC. - 30/09/2025",
      "conteudo": null,
      "url": "https://sistemasweb.b3.com.br/PlantaoNoticias/Noticias/Detail?idNoticia=3188742&agencia=18&dataNoticia=2025-12-30%2017:38:27",
      "id": 3188742,
      "categoria": "Outros"
    },
    {
      "data": "2025-12-30",
      "data_hora": "2025-12-30 17:37:50",
      "titulo": " 30/09/2025",
      "headline": "ECO SEC AGRO (ECOA) CRA E:271 S:1(s) DEMONST. FINANC. - 30/09/2025",
      "conteudo": null,
      "url": "https://sistemasweb.b3.com.br/PlantaoNoticias/Noticias/Detail?idNoticia=3188740&agencia=18&dataNoticia=2025-12-30%2017:37:50",
      "id": 3188740,
      "categoria": "Outros"
    },
    {
      "data": "2025-12-30",
      "data_hora": "2025-12-30 17:37:14",
      "titulo": " 30/09/2025",
      "headline": "ECO SEC AGRO (ECOA) CRA E:270 S:1(s) DEMONST. FINANC. - 30/09/2025",
      "conteudo": null,
      "url": "https://sistemasweb.b3.com.br/PlantaoNoticias/Noticias/Detail?idNoticia=3188735&agencia=18&dataNoticia=2025-12-30%2017:37:14",
      "id": 3188735,
      "categoria": "Outros"
    },
    {
      "data": "2025-12-30",
      "data_hora": "2025-12-30 17:36:38",
      "titulo": " 30/09/2025",
      "headline": "ECO SEC AGRO (ECOA) CRA E:269 S:1 DEMONST. FINANC. - 30/09/2025",
      "conteudo": null,
      "url": "https://sistemasweb.b3.com.br/PlantaoNoticias/Noticias/Detail?idNoticia=3188731&agencia=18&dataNoticia=2025-12-30%2017:36:38",
      "id": 3188731,
      "categoria": "Outros"
    },
    {
      "data": "2025-12-30",
      "data_hora": "2025-12-30 17:35:56",
      "titulo": " 30/09/2025",
      "headline": "ECO SEC AGRO (ECOA) CRA E:268 S:1(s) DEMONST. FINANC. - 30/09/2025",
      "conteudo": null,
      "url": "https://sistemasweb.b3.com.br/PlantaoNoticias/Noticias/Detail?idNoticia=3188729&agencia=18&dataNoticia=2025-12-30%2017:35:56",
      "id": 3188729,
      "categoria": "Outros"
    },
    {
      "data": "2025-12-30",
      "data_hora": "2025-12-30 17:35:06",
      "titulo": " 30/09/2025",
      "headline": "ECO SEC AGRO (ECOA) CRA E:267 S:1 DEMONST. FINANC. - 30/09/2025",
      "conteudo": null,
      "url": "https://sistemasweb.b3.com.br/PlantaoNoticias/Noticias/Detail?idNoticia=3188723&agencia=18&dataNoticia=2025-12-30%2017:35:06",
      "id": 3188723,
      "categoria": "Outros"
    },
    {
      "data": "2025-12-30",
      "data_hora": "2025-12-30 17:33:36",
      "titulo": " 30/09/2025",
      "headline": "ECO SEC AGRO (ECOA) CRA E:266 S:1(s) DEMONST. FINANC. - 30/09/2025",
      "conteudo": null,
      "url": "https://sistemasweb.b3.com.br/PlantaoNoticias/Noticias/Detail?idNoticia=3188707&agencia=18&dataNoticia=2025-12-30%2017:33:36",
      "id": 3188707,
      "categoria": "Outros"
    },
    {
      "data": "2025-12-30",
      "data_hora": "2025-12-30 17:33:00",
      "titulo": " 30/09/2025",
      "headline": "ECO SEC AGRO (ECOA) CRA E:264 S:1(s) DEMONST. FINANC. - 30/09/2025",
      "conteudo": null,
      "url": "https://sistemasweb.b3.com.br/PlantaoNoticias/Noticias/Detail?idNoticia=3188706&agencia=18&dataNoticia=2025-12-30%2017:33:00",
      "id": 3188706,
      "categoria": "Outros"
    },
    {
      "data": "2025-12-30",
      "data_hora": "2025-12-30 17:32:24",
      "titulo": " 30/09/2025",
      "headline": "ECO SEC AGRO (ECOA) CRA E:263 S:1 DEMONST. FINANC. - 30/09/2025",
      "conteudo": null,
      "url": "https://sistemasweb.b3.com.br/PlantaoNoticias/Noticias/Detail?idNoticia=3188703&agencia=18&dataNoticia=2025-12-30%2017:32:24",
      "id": 3188703,
      "categoria": "Outros"
    },
    {
      "data": "2025-12-30",
      "data_hora": "2025-12-30 17:31:01",
      "titulo": " 30/09/2025",
      "headline": "ECO SEC AGRO (ECOA) CRA E:262 S:1(s) DEMONST. FINANC. - 30/09/2025",
      "conteudo": null,
      "url": "https://sistemasweb.b3.com.br/PlantaoNoticias/Noticias/Detail?idNoticia=3188699&agencia=18&dataNoticia=2025-12-30%2017:31:01",
      "id": 3188699,
      "categoria": "Outros"
    },
    {
      "data": "2025-12-30",
      "data_hora": "2025-12-30 17:30:18",
      "titulo": " 30/09/2025",
      "headline": "ECO SEC AGRO (ECOA) CRA E:260 S:1(s) DEMONST. FINANC. - 30/09/2025",
      "conteudo": null,
      "url": "https://sistemasweb.b3.com.br/PlantaoNoticias/Noticias/Detail?idNoticia=3188697&agencia=18&dataNoticia=2025-12-30%2017:30:18",
      "id": 3188697,
      "categoria": "Outros"
    },
    {
      "data": "2025-12-30",
      "data_hora": "2025-12-30 17:27:24",
      "titulo": " 30/09/2025",
      "headline": "ECO SEC AGRO (ECOA) CRA E:255 S:1(s) DEMONST. FINANC. - 30/09/2025",
      "conteudo": null,
      "url": "https://sistemasweb.b3.com.br/PlantaoNoticias/Noticias/Detail?idNoticia=3188690&agencia=18&dataNoticia=2025-12-30%2017:27:24",
      "id": 3188690,
      "categoria": "Outros"
    },
    {
      "data": "2025-12-30",
      "data_hora": "2025-12-30 17:26:36",
      "titulo": " 30/09/2025",
      "headline": "ECO SEC AGRO (ECOA) CRA E:250 S:1(s) DEMONST. FINANC. - 30/09/2025",
      "conteudo": null,
      "url": "https://sistemasweb.b3.com.br/PlantaoNoticias/Noticias/Detail?idNoticia=3188684&agencia=18&dataNoticia=2025-12-30%2017:26:36",
      "id": 3188684,
      "categoria": "Outros"
    },
    {
      "data": "2025-12-30",
      "data_hora": "2025-12-30 17:25:58",
      "titulo": " 30/09/2025",
      "headline": "ECO SEC AGRO (ECOA) CRA E:247 S:1 DEMONST. FINANC. - 30/09/2025",
      "conteudo": null,
      "url": "https://sistemasweb.b3.com.br/PlantaoNoticias/Noticias/Detail?idNoticia=3188683&agencia=18&dataNoticia=2025-12-30%2017:25:58",
      "id": 3188683,
      "categoria": "Outros"
    },
    {
      "data": "2025-12-30",
      "data_hora": "2025-12-30 17:25:21",
      "titulo": " 30/09/2025",
      "headline": "ECO SEC AGRO (ECOA) CRA E:229 S:1(s) DEMONST. FINANC. - 30/09/2025",
      "conteudo": null,
      "url": "https://sistemasweb.b3.com.br/PlantaoNoticias/Noticias/Detail?idNoticia=3188681&agencia=18&dataNoticia=2025-12-30%2017:25:21",
      "id": 3188681,
      "categoria": "Outros"
    },
    {
      "data": "2025-12-30",
      "data_hora": "2025-12-30 17:24:35",
      "titulo": " 30/09/2025",
      "headline": "ECO SEC AGRO (ECOA) CRA E:223 S:1(s) DEMONST. FINANC. - 30/09/2025",
      "conteudo": null,
      "url": "https://sistemasweb.b3.com.br/PlantaoNoticias/Noticias/Detail?idNoticia=3188676&agencia=18&dataNoticia=2025-12-30%2017:24:35",
      "id": 3188676,
      "categoria": "Outros"
    },
    {
      "data": "2025-12-30",
      "data_hora": "2025-12-30 17:23:54",
      "titulo": " 30/09/2025",
      "headline": "ECO SEC AGRO (ECOA) CRA E:176 S:1 DEMONST. FINANC. - 30/09/2025",
      "conteudo": null,
      "url": "https://sistemasweb.b3.com.br/PlantaoNoticias/Noticias/Detail?idNoticia=3188675&agencia=18&dataNoticia=2025-12-30%2017:23:54",
      "id": 3188675,
      "categoria": "Outros"
    },
    {
      "data": "2025-12-30",
      "data_hora": "2025-12-30 17:23:18",
      "titulo": " 30/09/2025",
      "headline": "ECO SEC AGRO (ECOA) CRA E:172 S:1 DEMONST. FINANC. - 30/09/2025",
      "conteudo": null,
      "url": "https://sistemasweb.b3.com.br/PlantaoNoticias/Noticias/Detail?idNoticia=3188671&agencia=18&dataNoticia=2025-12-30%2017:23:18",
      "id": 3188671,
      "categoria": "Outros"
    },
    {
      "data": "2025-12-30",
      "data_hora": "2025-12-30 17:23:11",
      "titulo": " 30/09/2025",
      "headline": "ECO SEC AGRO (ECOA) CRA E:292 S:1(s) DEMONST. FINANC. - 30/09/2025",
      "conteudo": null,
      "url": "https://sistemasweb.b3.com.br/PlantaoNoticias/Noticias/Detail?idNoticia=3188670&agencia=18&dataNoticia=2025-12-30%2017:23:11",
      "id": 3188670,
      "categoria": "Outros"
    },
    {
      "data": "2025-12-30",
      "data_hora": "2025-12-30 17:22:41",
      "titulo": " 30/09/2025",
      "headline": "ECO SEC AGRO (ECOA) CRA E:154 S:1 DEMONST. FINANC. - 30/09/2025",
      "conteudo": null,
      "url": "https://sistemasweb.b3.com.br/PlantaoNoticias/Noticias/Detail?idNoticia=3188667&agencia=18&dataNoticia=2025-12-30%2017:22:41",
      "id": 3188667,
      "categoria": "Outros"
    },
    {
      "data": "2025-12-30",
      "data_hora": "2025-12-30 17:22:09",
      "titulo": " 30/09/2025",
      "headline": "ECO SEC AGRO (ECOA) CRA E:296 S:1(s) DEMONST. FINANC. - 30/09/2025",
      "conteudo": null,
      "url": "https://sistemasweb.b3.com.br/PlantaoNoticias/Noticias/Detail?idNoticia=3188662&agencia=18&dataNoticia=2025-12-30%2017:22:09",
      "id": 3188662,
      "categoria": "Outros"
    },
    {
      "data": "2025-12-30",
      "data_hora": "2025-12-30 17:21:51",
      "titulo": " 30/09/2025",
      "headline": "ECO SEC AGRO (ECOA) CRA E:153 S:1(s) DEMONST. FINANC. - 30/09/2025",
      "conteudo": null,
      "url": "https://sistemasweb.b3.com.br/PlantaoNoticias/Noticias/Detail?idNoticia=3188660&agencia=18&dataNoticia=2025-12-30%2017:21:51",
      "id": 3188660,
      "categoria": "Outros"
    },
    {
      "data": "2025-12-30",
      "data_hora": "2025-12-30 17:21:09",
      "titulo": " 30/09/2025",
      "headline": "ECO SEC AGRO (ECOA) CRA E:137 S:1(s) DEMONST. FINANC. - 30/09/2025",
      "conteudo": null,
      "url": "https://sistemasweb.b3.com.br/PlantaoNoticias/Noticias/Detail?idNoticia=3188657&agencia=18&dataNoticia=2025-12-30%2017:21:09",
      "id": 3188657,
      "categoria": "Outros"
    },
    {
      "data": "2025-12-30",
      "data_hora": "2025-12-30 17:21:08",
      "titulo": " 30/09/2025",
      "headline": "ECO SEC AGRO (ECOA) CRA E:297 S:1(s) DEMONST. FINANC. - 30/09/2025",
      "conteudo": null,
      "url": "https://sistemasweb.b3.com.br/PlantaoNoticias/Noticias/Detail?idNoticia=3188656&agencia=18&dataNoticia=2025-12-30%2017:21:08",
      "id": 3188656,
      "categoria": "Outros"
    },
    {
      "data": "2025-12-30",
      "data_hora": "2025-12-30 17:20:26",
      "titulo": " 30/09/2025",
      "headline": "ECO SEC AGRO (ECOA) CRA E:124 S:1(s) DEMONST. FINANC. - 30/09/2025",
      "conteudo": null,
      "url": "https://sistemasweb.b3.com.br/PlantaoNoticias/Noticias/Detail?idNoticia=3188653&agencia=18&dataNoticia=2025-12-30%2017:20:26",
      "id": 3188653,
      "categoria": "Outros"
    },
    {
      "data": "2025-12-30",
      "data_hora": "2025-12-30 17:20:16",
      "titulo": " 30/09/2025",
      "headline": "ECO SEC AGRO (ECOA) CRA E:298 S:1 DEMONST. FINANC. - 30/09/2025",
      "conteudo": null,
      "url": "https://sistemasweb.b3.com.br/PlantaoNoticias/Noticias/Detail?idNoticia=3188652&agencia=18&dataNoticia=2025-12-30%2017:20:16",
      "id": 3188652,
      "categoria": "Outros"
    },
    {
      "data": "2025-12-30",
      "data_hora": "2025-12-30 17:19:42",
      "titulo": " 30/09/2025",
      "headline": "ECO SEC AGRO (ECOA) CRA E:121 S:1 DEMONST. FINANC. - 30/09/2025",
      "conteudo": null,
      "url": "https://sistemasweb.b3.com.br/PlantaoNoticias/Noticias/Detail?idNoticia=3188647&agencia=18&dataNoticia=2025-12-30%2017:19:42",
      "id": 3188647,
      "categoria": "Outros"
    },
    {
      "data": "2025-12-30",
      "data_hora": "2025-12-30 17:19:13",
      "titulo": " 30/09/2025",
      "headline": "ECO SEC AGRO (ECOA) CRA E:299 S:1(s) DEMONST. FINANC. - 30/09/2025",
      "conteudo": null,
      "url": "https://sistemasweb.b3.com.br/PlantaoNoticias/Noticias/Detail?idNoticia=3188645&agencia=18&dataNoticia=2025-12-30%2017:19:13",
      "id": 3188645,
      "categoria": "Outros"
    },
    {
      "data": "2025-12-30",
      "data_hora": "2025-12-30 17:19:01",
      "titulo": " 30/09/2025",
      "headline": "ECO SEC AGRO (ECOA) CRA E:98 S:1 DEMONST. FINANC. - 30/09/2025",
      "conteudo": null,
      "url": "https://sistemasweb.b3.com.br/PlantaoNoticias/Noticias/Detail?idNoticia=3188643&agencia=18&dataNoticia=2025-12-30%2017:19:01",
      "id": 3188643,
      "categoria": "Outros"
    },
    {
      "data": "2025-12-30",
      "data_hora": "2025-12-30 17:18:21",
      "titulo": " 30/09/2025",
      "headline": "ECO SEC AGRO (ECOA) CRA E:300 S:1(s) DEMONST. FINANC. - 30/09/2025",
      "conteudo": null,
      "url": "https://sistemasweb.b3.com.br/PlantaoNoticias/Noticias/Detail?idNoticia=3188640&agencia=18&dataNoticia=2025-12-30%2017:18:21",
      "id": 3188640,
      "categoria": "Outros"
    },
    {
      "data": "2025-12-30",
      "data_hora": "2025-12-30 17:18:20",
      "titulo": " 30/09/2025",
      "headline": "ECO SEC AGRO (ECOA) CRA E:93 S:1(s) DEMONST. FINANC. - 30/09/2025",
      "conteudo": null,
      "url": "https://sistemasweb.b3.com.br/PlantaoNoticias/Noticias/Detail?idNoticia=3188639&agencia=18&dataNoticia=2025-12-30%2017:18:20",
      "id": 3188639,
      "categoria": "Outros"
    },
    {
      "data": "2025-12-30",
      "data_hora": "2025-12-30 17:17:44",
      "titulo": " 30/09/2025",
      "headline": "ECO SEC AGRO (ECOA) CRA E:92 S:1 DEMONST. FINANC. - 30/09/2025",
      "conteudo": null,
      "url": "https://sistemasweb.b3.com.br/PlantaoNoticias/Noticias/Detail?idNoticia=3188636&agencia=18&dataNoticia=2025-12-30%2017:17:44",
      "id": 3188636,
      "categoria": "Outros"
    },
    {
      "data": "2025-12-30",
      "data_hora": "2025-12-30 17:17:26",
      "titulo": " 30/09/2025",
      "headline": "ECO SEC AGRO (ECOA) CRA E:302 S:1(s) DEMONST. FINANC. - 30/09/2025",
      "conteudo": null,
      "url": "https://sistemasweb.b3.com.br/PlantaoNoticias/Noticias/Detail?idNoticia=3188635&agencia=18&dataNoticia=2025-12-30%2017:17:26",
      "id": 3188635,
      "categoria": "Outros"
    },
    {
      "data": "2025-12-30",
      "data_hora": "2025-12-30 17:17:03",
      "titulo": " 30/09/2025",
      "headline": "ECO SEC AGRO (ECOA) CRA E:90 S:1 DEMONST. FINANC. - 30/09/2025",
      "conteudo": null,
      "url": "https://sistemasweb.b3.com.br/PlantaoNoticias/Noticias/Detail?idNoticia=3188634&agencia=18&dataNoticia=2025-12-30%2017:17:03",
      "id": 3188634,
      "categoria": "Outros"
    },
    {
      "data": "2025-12-30",
      "data_hora": "2025-12-30 17:16:40",
      "titulo": " 30/09/2025",
      "headline": "ECO SEC AGRO (ECOA) CRA E:304 S:1(s) DEMONST. FINANC. - 30/09/2025",
      "conteudo": null,
      "url": "https://sistemasweb.b3.com.br/PlantaoNoticias/Noticias/Detail?idNoticia=3188632&agencia=18&dataNoticia=2025-12-30%2017:16:40",
      "id": 3188632,
      "categoria": "Outros"
    },
    {
      "data": "2025-12-30",
      "data_hora": "2025-12-30 17:16:03",
      "titulo": " 30/09/2025",
      "headline": "ECO SEC AGRO (ECOA) CRA E:58 S:1(s) DEMONST. FINANC. - 30/09/2025",
      "conteudo": null,
      "url": "https://sistemasweb.b3.com.br/PlantaoNoticias/Noticias/Detail?idNoticia=3188619&agencia=18&dataNoticia=2025-12-30%2017:16:03",
      "id": 3188619,
      "categoria": "Outros"
    },
    {
      "data": "2025-12-30",
      "data_hora": "2025-12-30 17:15:45",
      "titulo": " 30/09/2025",
      "headline": "ECO SEC AGRO (ECOA) CRA E:306 S:1(s) DEMONST. FINANC. - 30/09/2025",
      "conteudo": null,
      "url": "https://sistemasweb.b3.com.br/PlantaoNoticias/Noticias/Detail?idNoticia=3188617&agencia=18&dataNoticia=2025-12-30%2017:15:45",
      "id": 3188617,
      "categoria": "Outros"
    },
    {
      "data": "2025-12-30",
      "data_hora": "2025-12-30 17:14:52",
      "titulo": " 30/09/2025",
      "headline": "ECO SEC AGRO (ECOA) CRA E:310 S:1(s) DEMONST. FINANC. - 30/09/2025",
      "conteudo": null,
      "url": "https://sistemasweb.b3.com.br/PlantaoNoticias/Noticias/Detail?idNoticia=3188612&agencia=18&dataNoticia=2025-12-30%2017:14:52",
      "id": 3188612,
      "categoria": "Outros"
    },
    {
      "data": "2025-12-30",
      "data_hora": "2025-12-30 17:14:31",
      "titulo": " 30/09/2025",
      "headline": "ECO SEC AGRO (ECOA) CRA E:13 S:1(s) DEMONST. FINANC. - 30/09/2025",
      "conteudo": null,
      "url": "https://sistemasweb.b3.com.br/PlantaoNoticias/Noticias/Detail?idNoticia=3188610&agencia=18&dataNoticia=2025-12-30%2017:14:31",
      "id": 3188610,
      "categoria": "Outros"
    },
    {
      "data": "2025-12-30",
      "data_hora": "2025-12-30 17:13:58",
      "titulo": " 30/09/2025",
      "headline": "ECO SEC AGRO (ECOA) CRA E:334 S:1(s) DEMONST. FINANC. - 30/09/2025",
      "conteudo": null,
      "url": "https://sistemasweb.b3.com.br/PlantaoNoticias/Noticias/Detail?idNoticia=3188609&agencia=18&dataNoticia=2025-12-30%2017:13:58",
      "id": 3188609,
      "categoria": "Outros"
    },
    {
      "data": "2025-12-30",
      "data_hora": "2025-12-30 17:01:40",
      "titulo": " Outros Comunicados ao Mercado  30/12/25",
      "headline": "BKR GBL AGRO (BVEG) - Outros Comunicados ao Mercado - 30/12/25",
      "conteudo": null,
      "url": "https://sistemasweb.b3.com.br/PlantaoNoticias/Noticias/Detail?idNoticia=3188537&agencia=18&dataNoticia=2025-12-30%2017:01:40",
      "id": 3188537,
      "categoria": "Aviso"
    },
    {
      "data": "2025-12-30",
      "data_hora": "2025-12-30 16:03:13",
      "titulo": " Outros Comunicados ao Mercado  30/12/25",
      "headline": "BKR GBL AGRO (BVEG) - Outros Comunicados ao Mercado - 30/12/25",
      "conteudo": null,
      "url": "https://sistemasweb.b3.com.br/PlantaoNoticias/Noticias/Detail?idNoticia=3188298&agencia=18&dataNoticia=2025-12-30%2016:03:13",
      "id": 3188298,
      "categoria": "Aviso"
    },
    {
      "data": "2025-12-30",
      "data_hora": "2025-12-30 15:34:12",
      "titulo": " 30/12/2025 10:00",
      "headline": "ECO SEC AGRO (ECOA) CRA E:260 S:1(s) ATA AGOE - 30/12/2025 10:00",
      "conteudo": null,
      "url": "https://sistemasweb.b3.com.br/PlantaoNoticias/Noticias/Detail?idNoticia=3188223&agencia=18&dataNoticia=2025-12-30%2015:34:12",
      "id": 3188223,
      "categoria": "Governança"
    },
    {
      "data": "2025-12-30",
      "data_hora": "2025-12-30 11:42:57",
      "titulo": " 30/12/2025 10:00",
      "headline": "ECO SEC AGRO (ECOA) CRA E:279 S:1(s) ATA AGOE - 30/12/2025 10:00",
      "conteudo": null,
      "url": "https://sistemasweb.b3.com.br/PlantaoNoticias/Noticias/Detail?idNoticia=3187873&agencia=18&dataNoticia=2025-12-30%2011:42:57",
      "id": 3187873,
      "categoria": "Governança"
    },
    {
      "data": "2025-12-30",
      "data_hora": "2025-12-30 10:30:07",
      "titulo": " 12/01/2026 11:00",
      "headline": "ECO SEC AGRO (ECOA) CRA E:352 S:1 PROPOSTA AGOE - 12/01/2026 11:00",
      "conteudo": null,
      "url": "https://sistemasweb.b3.com.br/PlantaoNoticias/Noticias/Detail?idNoticia=3187776&agencia=18&dataNoticia=2025-12-30%2010:30:07",
      "id": 3187776,
      "categoria": "Governança"
    },
    {
      "data": "2025-12-26",
      "data_hora": "2025-12-26 18:25:18",
      "titulo": " 19/12/2025",
      "headline": "ECO SEC AGRO (ECOA) CRA E:439 S:1(s) TERMO SECURITIZACAO. - 19/12/2025",
      "conteudo": null,
      "url": "https://sistemasweb.b3.com.br/PlantaoNoticias/Noticias/Detail?idNoticia=3185423&agencia=18&dataNoticia=2025-12-26%2018:25:18",
      "id": 3185423,
      "categoria": "Outros"
    },
    {
      "data": "2025-12-26",
      "data_hora": "2025-12-26 18:18:24",
      "titulo": " 26/12/2025",
      "headline": "ECO SEC AGRO (ECOA) CRA E:439 S:1(s) ANUNCIO DE INICIO - 26/12/2025",
      "conteudo": null,
      "url": "https://sistemasweb.b3.com.br/PlantaoNoticias/Noticias/Detail?idNoticia=3185407&agencia=18&dataNoticia=2025-12-26%2018:18:24",
      "id": 3185407,
      "categoria": "Outros"
    },
    {
      "data": "2025-12-26",
      "data_hora": "2025-12-26 17:38:42",
      "titulo": " 26/12/2025 16:00",
      "headline": "ECO SEC AGRO (ECOA) CRA E:353 S:1(s) ATA AGOE - 26/12/2025 16:00",
      "conteudo": null,
      "url": "https://sistemasweb.b3.com.br/PlantaoNoticias/Noticias/Detail?idNoticia=3185234&agencia=18&dataNoticia=2025-12-26%2017:38:42",
      "id": 3185234,
      "categoria": "Governança"
    },
    {
      "data": "2025-12-26",
      "data_hora": "2025-12-26 17:20:58",
      "titulo": " 26/12/2025 10:00",
      "headline": "ECO SEC AGRO (ECOA) CRA E:266 S:1(s) ATA AGOE - 26/12/2025 10:00",
      "conteudo": null,
      "url": "https://sistemasweb.b3.com.br/PlantaoNoticias/Noticias/Detail?idNoticia=3185201&agencia=18&dataNoticia=2025-12-26%2017:20:58",
      "id": 3185201,
      "categoria": "Governança"
    },
    {
      "data": "2025-12-26",
      "data_hora": "2025-12-26 17:11:54",
      "titulo": " 26/12/2025",
      "headline": "ECO SEC AGRO (ECOA) CRA E:370 S:1(s) Comunicado ao mercado - 26/12/2025",
      "conteudo": null,
      "url": "https://sistemasweb.b3.com.br/PlantaoNoticias/Noticias/Detail?idNoticia=3185187&agencia=18&dataNoticia=2025-12-26%2017:11:54",
      "id": 3185187,
      "categoria": "Aviso"
    },
    {
      "data": "2025-12-26",
      "data_hora": "2025-12-26 08:03:54",
      "titulo": " 24/12/2025",
      "headline": "ECO SEC AGRO (ECOA) CRA E:169 S:1(s) Comunicado ao mercado - 24/12/2025",
      "conteudo": null,
      "url": "https://sistemasweb.b3.com.br/PlantaoNoticias/Noticias/Detail?idNoticia=3183906&agencia=18&dataNoticia=2025-12-26%2008:03:54",
      "id": 3183906,
      "categoria": "Aviso"
    },
    {
      "data": "2025-12-26",
      "data_hora": "2025-12-26 08:03:54",
      "titulo": " 24/12/2025",
      "headline": "ECO SEC AGRO (ECOA) CRA E:185 S:1(s) Comunicado ao mercado - 24/12/2025",
      "conteudo": null,
      "url": "https://sistemasweb.b3.com.br/PlantaoNoticias/Noticias/Detail?idNoticia=3183908&agencia=18&dataNoticia=2025-12-26%2008:03:54",
      "id": 3183908,
      "categoria": "Aviso"
    },
    {
      "data": "2025-12-26",
      "data_hora": "2025-12-26 08:03:54",
      "titulo": " 24/12/2025",
      "headline": "ECO SEC AGRO (ECOA) CRA E:131 S:1(s) Comunicado ao mercado - 24/12/2025",
      "conteudo": null,
      "url": "https://sistemasweb.b3.com.br/PlantaoNoticias/Noticias/Detail?idNoticia=3183909&agencia=18&dataNoticia=2025-12-26%2008:03:54",
      "id": 3183909,
      "categoria": "Aviso"
    },
    {
      "data": "2025-12-23",
      "data_hora": "2025-12-23 19:37:29",
      "titulo": " 23/12/2025",
      "headline": "ECO SEC AGRO (ECOA) CRA E:440 S:1 ANUNCIO ENCERRAMENTO - 23/12/2025",
      "conteudo": null,
      "url": "https://sistemasweb.b3.com.br/PlantaoNoticias/Noticias/Detail?idNoticia=3183636&agencia=18&dataNoticia=2025-12-23%2019:37:29",
      "id": 3183636,
      "categoria": "Outros"
    },
    {
      "data": "2025-12-23",
      "data_hora": "2025-12-23 18:18:53",
      "titulo": " 23/12/2025",
      "headline": "ECO SEC AGRO (ECOA) CRA E:260 S:1(s) Comunicado ao mercado - 23/12/2025",
      "conteudo": null,
      "url": "https://sistemasweb.b3.com.br/PlantaoNoticias/Noticias/Detail?idNoticia=3183473&agencia=18&dataNoticia=2025-12-23%2018:18:53",
      "id": 3183473,
      "categoria": "Aviso"
    },
    {
      "data": "2025-12-23",
      "data_hora": "2025-12-23 18:08:12",
      "titulo": " 23/12/2025",
      "headline": "ECO SEC AGRO (ECOA) CRA E:413 S:1(s) ANUNCIO ENCERRAMENTO - 23/12/2025",
      "conteudo": null,
      "url": "https://sistemasweb.b3.com.br/PlantaoNoticias/Noticias/Detail?idNoticia=3183375&agencia=18&dataNoticia=2025-12-23%2018:08:12",
      "id": 3183375,
      "categoria": "Outros"
    },
    {
      "data": "2025-12-23",
      "data_hora": "2025-12-23 17:47:57",
      "titulo": " 12/01/2025 11:00",
      "headline": "ECO SEC AGRO (ECOA) CRA E:352 S:1 EDITAL AGOE - 12/01/2025 11:00",
      "conteudo": null,
      "url": "https://sistemasweb.b3.com.br/PlantaoNoticias/Noticias/Detail?idNoticia=3183209&agencia=18&dataNoticia=2025-12-23%2017:47:57",
      "id": 3183209,
      "categoria": "Governança"
    },
    {
      "data": "2025-12-23",
      "data_hora": "2025-12-23 14:05:42",
      "titulo": " 23/12/2025 11:00",
      "headline": "ECO SEC AGRO (ECOA) CRA E:137 S:1(s) ATA AGOE - 23/12/2025 11:00",
      "conteudo": null,
      "url": "https://sistemasweb.b3.com.br/PlantaoNoticias/Noticias/Detail?idNoticia=3182725&agencia=18&dataNoticia=2025-12-23%2014:05:42",
      "id": 3182725,
      "categoria": "Governança"
    },
    {
      "data": "2025-12-23",
      "data_hora": "2025-12-23 10:30:24",
      "titulo": " Aviso aos Acionistas  22/12/25 (N)",
      "headline": "BKR GBL AGRO (BVEG) - Aviso aos Acionistas - 22/12/25 (N)",
      "conteudo": null,
      "url": "https://sistemasweb.b3.com.br/PlantaoNoticias/Noticias/Detail?idNoticia=3182267&agencia=18&dataNoticia=2025-12-23%2010:30:24",
      "id": 3182267,
      "categoria": "Aviso"
    },
    {
      "data": "2025-12-23",
      "data_hora": "2025-12-23 08:02:28",
      "titulo": " 22/12/2025",
      "headline": "ECO SEC AGRO (ECOA) CRA E:434 S:1(s) ANUNCIO ENCERRAMENTO - 22/12/2025",
      "conteudo": null,
      "url": "https://sistemasweb.b3.com.br/PlantaoNoticias/Noticias/Detail?idNoticia=3181970&agencia=18&dataNoticia=2025-12-23%2008:02:28",
      "id": 3181970,
      "categoria": "Outros"
    },
    {
      "data": "2025-12-23",
      "data_hora": "2025-12-23 08:02:26",
      "titulo": " 22/12/2025",
      "headline": "ECO SEC AGRO (ECOA) CRA E:426 S:1(s) ANUNCIO ENCERRAMENTO - 22/12/2025",
      "conteudo": null,
      "url": "https://sistemasweb.b3.com.br/PlantaoNoticias/Noticias/Detail?idNoticia=3181951&agencia=18&dataNoticia=2025-12-23%2008:02:26",
      "id": 3181951,
      "categoria": "Outros"
    },
    {
      "data": "2025-12-22",
      "data_hora": "2025-12-22 19:52:48",
      "titulo": "15  AGE  Carta Consulta  07/02/2026 10:00",
      "headline": "FII BTG AGRO (BTAL) 36.642.244/0001-15 - AGE - Carta Consulta - 07/02/2026 10:00",
      "conteudo": null,
      "url": "https://sistemasweb.b3.com.br/PlantaoNoticias/Noticias/Detail?idNoticia=3181786&agencia=18&dataNoticia=2025-12-22%2019:52:48",
      "id": 3181786,
      "categoria": "Governança"
    },
    {
      "data": "2025-12-22",
      "data_hora": "2025-12-22 19:36:44",
      "titulo": " Anuncio Encerramento Distribuicao Publica22/12/25",
      "headline": "COLOMBO AGRO (    ) - Anuncio Encerramento Distribuicao Publica-22/12/25",
      "conteudo": null,
      "url": "https://sistemasweb.b3.com.br/PlantaoNoticias/Noticias/Detail?idNoticia=3181774&agencia=18&dataNoticia=2025-12-22%2019:36:44",
      "id": 3181774,
      "categoria": "Outros"
    },
    {
      "data": "2025-12-22",
      "data_hora": "2025-12-22 18:13:41",
      "titulo": " 30/12/2025 10:00",
      "headline": "ECO SEC AGRO (ECOA) CRA E:279 S:1(s) EDITAL AGOE - 30/12/2025 10:00",
      "conteudo": null,
      "url": "https://sistemasweb.b3.com.br/PlantaoNoticias/Noticias/Detail?idNoticia=3181480&agencia=18&dataNoticia=2025-12-22%2018:13:41",
      "id": 3181480,
      "categoria": "Governança"
    },
    {
      "data": "2025-12-22",
      "data_hora": "2025-12-22 18:01:48",
      "titulo": " 22/12/2025",
      "headline": "ECO SEC AGRO (ECOA) CRA E:353 S:1(s) Comunicado ao mercado - 22/12/2025",
      "conteudo": null,
      "url": "https://sistemasweb.b3.com.br/PlantaoNoticias/Noticias/Detail?idNoticia=3181306&agencia=18&dataNoticia=2025-12-22%2018:01:48",
      "id": 3181306,
      "categoria": "Aviso"
    },
    {
      "data": "2025-12-22",
      "data_hora": "2025-12-22 17:57:26",
      "titulo": " 22/12/2025 11:00",
      "headline": "ECO SEC AGRO (ECOA) CRA E:345 S:1(s) ATA AGOE - 22/12/2025 11:00",
      "conteudo": null,
      "url": "https://sistemasweb.b3.com.br/PlantaoNoticias/Noticias/Detail?idNoticia=3181291&agencia=18&dataNoticia=2025-12-22%2017:57:26",
      "id": 3181291,
      "categoria": "Governança"
    },
    {
      "data": "2025-12-22",
      "data_hora": "2025-12-22 15:23:59",
      "titulo": " 22/12/2025 14:00",
      "headline": "ECO SEC AGRO (ECOA) CRA E:279 S:1(s) ATA AGOE - 22/12/2025 14:00",
      "conteudo": null,
      "url": "https://sistemasweb.b3.com.br/PlantaoNoticias/Noticias/Detail?idNoticia=3180747&agencia=18&dataNoticia=2025-12-22%2015:23:59",
      "id": 3180747,
      "categoria": "Governança"
    },
    {
      "data": "2025-12-22",
      "data_hora": "2025-12-22 15:04:19",
      "titulo": " Aviso aos Acionistas  22/12/25",
      "headline": "BKR GBL AGRO (BVEG) - Aviso aos Acionistas - 22/12/25",
      "conteudo": null,
      "url": "https://sistemasweb.b3.com.br/PlantaoNoticias/Noticias/Detail?idNoticia=3180621&agencia=18&dataNoticia=2025-12-22%2015:04:19",
      "id": 3180621,
      "categoria": "Aviso"
    },
    {
      "data": "2025-12-22",
      "data_hora": "2025-12-22 08:00:58",
      "titulo": " Outros Comunicados ao Mercado  19/12/25",
      "headline": "BKR GBL AGRO (BVEG) - Outros Comunicados ao Mercado - 19/12/25",
      "conteudo": null,
      "url": "https://sistemasweb.b3.com.br/PlantaoNoticias/Noticias/Detail?idNoticia=3179210&agencia=18&dataNoticia=2025-12-22%2008:00:58",
      "id": 3179210,
      "categoria": "Aviso"
    },
    {
      "data": "2025-12-19",
      "data_hora": "2025-12-19 19:18:04",
      "titulo": " 19/12/2025",
      "headline": "ECO SEC AGRO (ECOA) CRA E:440 S:1 ANUNCIO DE INICIO - 19/12/2025",
      "conteudo": null,
      "url": "https://sistemasweb.b3.com.br/PlantaoNoticias/Noticias/Detail?idNoticia=3179065&agencia=18&dataNoticia=2025-12-19%2019:18:04",
      "id": 3179065,
      "categoria": "Outros"
    },
    {
      "data": "2025-12-19",
      "data_hora": "2025-12-19 18:24:07",
      "titulo": "53  AGO  Carta Consulta  26/01/2026 10:00",
      "headline": "FI AGRO FYTO (FTCA) 42.537.438/0001-53 - AGO - Carta Consulta - 26/01/2026 10:00",
      "conteudo": null,
      "url": "https://sistemasweb.b3.com.br/PlantaoNoticias/Noticias/Detail?idNoticia=3178858&agencia=18&dataNoticia=2025-12-19%2018:24:07",
      "id": 3178858,
      "categoria": "Governança"
    },
    {
      "data": "2025-12-19",
      "data_hora": "2025-12-19 17:41:03",
      "titulo": " 19/12/2025",
      "headline": "ECO SEC AGRO (ECOA) CRA E:322 S:1 Comunicado ao mercado - 19/12/2025",
      "conteudo": null,
      "url": "https://sistemasweb.b3.com.br/PlantaoNoticias/Noticias/Detail?idNoticia=3178548&agencia=18&dataNoticia=2025-12-19%2017:41:03",
      "id": 3178548,
      "categoria": "Aviso"
    },
    {
      "data": "2025-12-19",
      "data_hora": "2025-12-19 16:13:59",
      "titulo": " 19/12/2025",
      "headline": "ECO SEC AGRO (ECOA) CRA E:157 S:1(s) Comunicado ao mercado - 19/12/2025",
      "conteudo": null,
      "url": "https://sistemasweb.b3.com.br/PlantaoNoticias/Noticias/Detail?idNoticia=3178329&agencia=18&dataNoticia=2025-12-19%2016:13:59",
      "id": 3178329,
      "categoria": "Aviso"
    },
    {
      "data": "2025-12-19",
      "data_hora": "2025-12-19 15:20:55",
      "titulo": " 19/12/2025",
      "headline": "ECO SEC AGRO (ECOA) CRA E:104 S:1 Comunicado ao mercado - 19/12/2025",
      "conteudo": null,
      "url": "https://sistemasweb.b3.com.br/PlantaoNoticias/Noticias/Detail?idNoticia=3178240&agencia=18&dataNoticia=2025-12-19%2015:20:55",
      "id": 3178240,
      "categoria": "Aviso"
    },
    {
      "data": "2025-12-19",
      "data_hora": "2025-12-19 12:59:18",
      "titulo": " 08/01/2026 10:00",
      "headline": "ECO SEC AGRO (ECOA) CRA E:100 S:1 PROPOSTA AGOE - 08/01/2026 10:00",
      "conteudo": null,
      "url": "https://sistemasweb.b3.com.br/PlantaoNoticias/Noticias/Detail?idNoticia=3178019&agencia=18&dataNoticia=2025-12-19%2012:59:18",
      "id": 3178019,
      "categoria": "Governança"
    },
    {
      "data": "2025-12-19",
      "data_hora": "2025-12-19 12:58:34",
      "titulo": " 05/01/2026 11:15",
      "headline": "ECO SEC AGRO (ECOA) CRA E:196 S:1(s) PROPOSTA AGOE - 05/01/2026 11:15",
      "conteudo": null,
      "url": "https://sistemasweb.b3.com.br/PlantaoNoticias/Noticias/Detail?idNoticia=3178018&agencia=18&dataNoticia=2025-12-19%2012:58:34",
      "id": 3178018,
      "categoria": "Governança"
    },
    {
      "data": "2025-12-19",
      "data_hora": "2025-12-19 12:57:43",
      "titulo": " 08/01/2026 10:15",
      "headline": "ECO SEC AGRO (ECOA) CRA E:145 S:1(s) PROPOSTA AGOE - 08/01/2026 10:15",
      "conteudo": null,
      "url": "https://sistemasweb.b3.com.br/PlantaoNoticias/Noticias/Detail?idNoticia=3178017&agencia=18&dataNoticia=2025-12-19%2012:57:43",
      "id": 3178017,
      "categoria": "Governança"
    },
    {
      "data": "2025-12-19",
      "data_hora": "2025-12-19 12:57:07",
      "titulo": " 08/01/2026 10:30",
      "headline": "ECO SEC AGRO (ECOA) CRA E:131 S:1(s) PROPOSTA AGOE - 08/01/2026 10:30",
      "conteudo": null,
      "url": "https://sistemasweb.b3.com.br/PlantaoNoticias/Noticias/Detail?idNoticia=3178016&agencia=18&dataNoticia=2025-12-19%2012:57:07",
      "id": 3178016,
      "categoria": "Governança"
    },
    {
      "data": "2025-12-19",
      "data_hora": "2025-12-19 12:51:29",
      "titulo": " 05/01/2026 10:00",
      "headline": "ECO SEC AGRO (ECOA) CRI E:1 S:1 PROPOSTA AGOE - 05/01/2026 10:00",
      "conteudo": null,
      "url": "https://sistemasweb.b3.com.br/PlantaoNoticias/Noticias/Detail?idNoticia=3178011&agencia=18&dataNoticia=2025-12-19%2012:51:29",
      "id": 3178011,
      "categoria": "Governança"
    },
    {
      "data": "2025-12-19",
      "data_hora": "2025-12-19 12:50:57",
      "titulo": " 06/01/2026 15:15",
      "headline": "ECO SEC AGRO (ECOA) CRI E:3 S:1 PROPOSTA AGOE - 06/01/2026 15:15",
      "conteudo": null,
      "url": "https://sistemasweb.b3.com.br/PlantaoNoticias/Noticias/Detail?idNoticia=3178009&agencia=18&dataNoticia=2025-12-19%2012:50:57",
      "id": 3178009,
      "categoria": "Governança"
    },
    {
      "data": "2025-12-19",
      "data_hora": "2025-12-19 12:48:29",
      "titulo": " 05/01/2026 15:30",
      "headline": "ECO SEC AGRO (ECOA) CRA E:225 S:1 PROPOSTA AGOE - 05/01/2026 15:30",
      "conteudo": null,
      "url": "https://sistemasweb.b3.com.br/PlantaoNoticias/Noticias/Detail?idNoticia=3178005&agencia=18&dataNoticia=2025-12-19%2012:48:29",
      "id": 3178005,
      "categoria": "Governança"
    },
    {
      "data": "2025-12-19",
      "data_hora": "2025-12-19 12:47:25",
      "titulo": " 05/01/2026 15:00",
      "headline": "ECO SEC AGRO (ECOA) CRA E:224 S:1 PROPOSTA AGOE - 05/01/2026 15:00",
      "conteudo": null,
      "url": "https://sistemasweb.b3.com.br/PlantaoNoticias/Noticias/Detail?idNoticia=3178001&agencia=18&dataNoticia=2025-12-19%2012:47:25",
      "id": 3178001,
      "categoria": "Governança"
    },
    {
      "data": "2025-12-19",
      "data_hora": "2025-12-19 12:46:52",
      "titulo": " 05/01/2026 11:45",
      "headline": "ECO SEC AGRO (ECOA) CRA E:222 S:1 PROPOSTA AGOE - 05/01/2026 11:45",
      "conteudo": null,
      "url": "https://sistemasweb.b3.com.br/PlantaoNoticias/Noticias/Detail?idNoticia=3178000&agencia=18&dataNoticia=2025-12-19%2012:46:52",
      "id": 3178000,
      "categoria": "Governança"
    },
    {
      "data": "2025-12-19",
      "data_hora": "2025-12-19 12:46:09",
      "titulo": " 05/01/2026 11:30",
      "headline": "ECO SEC AGRO (ECOA) CRA E:221 S:1 PROPOSTA AGOE - 05/01/2026 11:30",
      "conteudo": null,
      "url": "https://sistemasweb.b3.com.br/PlantaoNoticias/Noticias/Detail?idNoticia=3177997&agencia=18&dataNoticia=2025-12-19%2012:46:09",
      "id": 3177997,
      "categoria": "Governança"
    },
    {
      "data": "2025-12-19",
      "data_hora": "2025-12-19 12:45:31",
      "titulo": " 08/01/2026 11:00",
      "headline": "ECO SEC AGRO (ECOA) CRA E:308 S:1 PROPOSTA AGOE - 08/01/2026 11:00",
      "conteudo": null,
      "url": "https://sistemasweb.b3.com.br/PlantaoNoticias/Noticias/Detail?idNoticia=3177996&agencia=18&dataNoticia=2025-12-19%2012:45:31",
      "id": 3177996,
      "categoria": "Governança"
    },
    {
      "data": "2025-12-19",
      "data_hora": "2025-12-19 12:44:45",
      "titulo": " 06/01/2026 14:45",
      "headline": "ECO SEC AGRO (ECOA) CRA E:295 S:1(s) PROPOSTA AGOE - 06/01/2026 14:45",
      "conteudo": null,
      "url": "https://sistemasweb.b3.com.br/PlantaoNoticias/Noticias/Detail?idNoticia=3177994&agencia=18&dataNoticia=2025-12-19%2012:44:45",
      "id": 3177994,
      "categoria": "Governança"
    },
    {
      "data": "2025-12-19",
      "data_hora": "2025-12-19 12:43:53",
      "titulo": " 05/01/2026 16:00",
      "headline": "ECO SEC AGRO (ECOA) CRA E:259 S:1(s) PROPOSTA AGOE - 05/01/2026 16:00",
      "conteudo": null,
      "url": "https://sistemasweb.b3.com.br/PlantaoNoticias/Noticias/Detail?idNoticia=3177991&agencia=18&dataNoticia=2025-12-19%2012:43:53",
      "id": 3177991,
      "categoria": "Governança"
    },
    {
      "data": "2025-12-19",
      "data_hora": "2025-12-19 12:43:09",
      "titulo": " 07/01/2026 16:00",
      "headline": "ECO SEC AGRO (ECOA) CRA E:257 S:1 PROPOSTA AGOE - 07/01/2026 16:00",
      "conteudo": null,
      "url": "https://sistemasweb.b3.com.br/PlantaoNoticias/Noticias/Detail?idNoticia=3177988&agencia=18&dataNoticia=2025-12-19%2012:43:09",
      "id": 3177988,
      "categoria": "Governança"
    },
    {
      "data": "2025-12-19",
      "data_hora": "2025-12-19 12:42:25",
      "titulo": " 05/01/2026 15:30",
      "headline": "ECO SEC AGRO (ECOA) CRA E:239 S:1 PROPOSTA AGOE - 05/01/2026 15:30",
      "conteudo": null,
      "url": "https://sistemasweb.b3.com.br/PlantaoNoticias/Noticias/Detail?idNoticia=3177983&agencia=18&dataNoticia=2025-12-19%2012:42:25",
      "id": 3177983,
      "categoria": "Governança"
    },
    {
      "data": "2025-12-19",
      "data_hora": "2025-12-19 12:41:23",
      "titulo": " 05/01/2026 15:45",
      "headline": "ECO SEC AGRO (ECOA) CRA E:234 S:1(s) PROPOSTA AGOE - 05/01/2026 15:45",
      "conteudo": null,
      "url": "https://sistemasweb.b3.com.br/PlantaoNoticias/Noticias/Detail?idNoticia=3177978&agencia=18&dataNoticia=2025-12-19%2012:41:23",
      "id": 3177978,
      "categoria": "Governança"
    },
    {
      "data": "2025-12-19",
      "data_hora": "2025-12-19 12:40:36",
      "titulo": " 05/01/2026 14:15",
      "headline": "ECO SEC AGRO (ECOA) CRA E:231 S:1(s) PROPOSTA AGOE - 05/01/2026 14:15",
      "conteudo": null,
      "url": "https://sistemasweb.b3.com.br/PlantaoNoticias/Noticias/Detail?idNoticia=3177975&agencia=18&dataNoticia=2025-12-19%2012:40:36",
      "id": 3177975,
      "categoria": "Governança"
    },
    {
      "data": "2025-12-19",
      "data_hora": "2025-12-19 12:39:40",
      "titulo": " 05/01/2026 14:45",
      "headline": "ECO SEC AGRO (ECOA) CRA E:228 S:1 PROPOSTA AGOE - 05/01/2026 14:45",
      "conteudo": null,
      "url": "https://sistemasweb.b3.com.br/PlantaoNoticias/Noticias/Detail?idNoticia=3177973&agencia=18&dataNoticia=2025-12-19%2012:39:40",
      "id": 3177973,
      "categoria": "Governança"
    },
    {
      "data": "2025-12-19",
      "data_hora": "2025-12-19 12:38:52",
      "titulo": " 05/01/2026 15:15",
      "headline": "ECO SEC AGRO (ECOA) CRA E:227 S:1(s) PROPOSTA AGOE - 05/01/2026 15:15",
      "conteudo": null,
      "url": "https://sistemasweb.b3.com.br/PlantaoNoticias/Noticias/Detail?idNoticia=3177970&agencia=18&dataNoticia=2025-12-19%2012:38:52",
      "id": 3177970,
      "categoria": "Governança"
    },
    {
      "data": "2025-12-19",
      "data_hora": "2025-12-19 12:37:31",
      "titulo": " 05/01/2026 12:00",
      "headline": "ECO SEC AGRO (ECOA) CRA E:216 S:1(s) PROPOSTA AGOE - 05/01/2026 12:00",
      "conteudo": null,
      "url": "https://sistemasweb.b3.com.br/PlantaoNoticias/Noticias/Detail?idNoticia=3177965&agencia=18&dataNoticia=2025-12-19%2012:37:31",
      "id": 3177965,
      "categoria": "Governança"
    },
    {
      "data": "2025-12-19",
      "data_hora": "2025-12-19 12:35:45",
      "titulo": " 05/01/2026 10:30",
      "headline": "ECO SEC AGRO (ECOA) CRA E:209 S:1 PROPOSTA AGOE - 05/01/2026 10:30",
      "conteudo": null,
      "url": "https://sistemasweb.b3.com.br/PlantaoNoticias/Noticias/Detail?idNoticia=3177961&agencia=18&dataNoticia=2025-12-19%2012:35:45",
      "id": 3177961,
      "categoria": "Governança"
    },
    {
      "data": "2025-12-19",
      "data_hora": "2025-12-19 12:34:16",
      "titulo": " 05/01/2026 11:00",
      "headline": "ECO SEC AGRO (ECOA) CRA E:208 S:1 PROPOSTA AGOE - 05/01/2026 11:00",
      "conteudo": null,
      "url": "https://sistemasweb.b3.com.br/PlantaoNoticias/Noticias/Detail?idNoticia=3177951&agencia=18&dataNoticia=2025-12-19%2012:34:16",
      "id": 3177951,
      "categoria": "Governança"
    },
    {
      "data": "2025-12-19",
      "data_hora": "2025-12-19 12:33:14",
      "titulo": " 05/01/2026 10:45",
      "headline": "ECO SEC AGRO (ECOA) CRA E:207 S:1 PROPOSTA AGOE - 05/01/2026 10:45",
      "conteudo": null,
      "url": "https://sistemasweb.b3.com.br/PlantaoNoticias/Noticias/Detail?idNoticia=3177949&agencia=18&dataNoticia=2025-12-19%2012:33:14",
      "id": 3177949,
      "categoria": "Governança"
    },
    {
      "data": "2025-12-19",
      "data_hora": "2025-12-19 12:32:27",
      "titulo": " 08/01/2026 10:45",
      "headline": "ECO SEC AGRO (ECOA) CRA E:200 S:1 PROPOSTA AGOE - 08/01/2026 10:45",
      "conteudo": null,
      "url": "https://sistemasweb.b3.com.br/PlantaoNoticias/Noticias/Detail?idNoticia=3177947&agencia=18&dataNoticia=2025-12-19%2012:32:27",
      "id": 3177947,
      "categoria": "Governança"
    },
    {
      "data": "2025-12-19",
      "data_hora": "2025-12-19 12:30:54",
      "titulo": " 06/01/2026 15:30",
      "headline": "ECO SEC AGRO (ECOA) CRA E:378 S:1(s) PROPOSTA AGOE - 06/01/2026 15:30",
      "conteudo": null,
      "url": "https://sistemasweb.b3.com.br/PlantaoNoticias/Noticias/Detail?idNoticia=3177944&agencia=18&dataNoticia=2025-12-19%2012:30:54",
      "id": 3177944,
      "categoria": "Governança"
    },
    {
      "data": "2025-12-19",
      "data_hora": "2025-12-19 12:29:10",
      "titulo": " 08/01/2026 11:30",
      "headline": "ECO SEC AGRO (ECOA) CRA E:354 S:1(s) PROPOSTA AGOE - 08/01/2026 11:30",
      "conteudo": null,
      "url": "https://sistemasweb.b3.com.br/PlantaoNoticias/Noticias/Detail?idNoticia=3177943&agencia=18&dataNoticia=2025-12-19%2012:29:10",
      "id": 3177943,
      "categoria": "Governança"
    },
    {
      "data": "2025-12-19",
      "data_hora": "2025-12-19 11:51:26",
      "titulo": " 06/01/2026 14:30",
      "headline": "ECO SEC AGRO (ECOA) CRA E:352 S:1 PROPOSTA AGOE - 06/01/2026 14:30",
      "conteudo": null,
      "url": "https://sistemasweb.b3.com.br/PlantaoNoticias/Noticias/Detail?idNoticia=3177865&agencia=18&dataNoticia=2025-12-19%2011:51:26",
      "id": 3177865,
      "categoria": "Governança"
    },
    {
      "data": "2025-12-19",
      "data_hora": "2025-12-19 11:50:18",
      "titulo": " 05/01/2026 14:00",
      "headline": "ECO SEC AGRO (ECOA) CRA E:342 S:1(s) PROPOSTA AGOE - 05/01/2026 14:00",
      "conteudo": null,
      "url": "https://sistemasweb.b3.com.br/PlantaoNoticias/Noticias/Detail?idNoticia=3177860&agencia=18&dataNoticia=2025-12-19%2011:50:18",
      "id": 3177860,
      "categoria": "Governança"
    },
    {
      "data": "2025-12-19",
      "data_hora": "2025-12-19 11:48:25",
      "titulo": " 08/01/2026 11:15",
      "headline": "ECO SEC AGRO (ECOA) CRA E:332 S:1(s) PROPOSTA AGOE - 08/01/2026 11:15",
      "conteudo": null,
      "url": "https://sistemasweb.b3.com.br/PlantaoNoticias/Noticias/Detail?idNoticia=3177853&agencia=18&dataNoticia=2025-12-19%2011:48:25",
      "id": 3177853,
      "categoria": "Governança"
    },
    {
      "data": "2025-12-19",
      "data_hora": "2025-12-19 11:47:00",
      "titulo": " 06/01/2026 14:15",
      "headline": "ECO SEC AGRO (ECOA) CRA E:328 S:1 PROPOSTA AGOE - 06/01/2026 14:15",
      "conteudo": null,
      "url": "https://sistemasweb.b3.com.br/PlantaoNoticias/Noticias/Detail?idNoticia=3177849&agencia=18&dataNoticia=2025-12-19%2011:47:00",
      "id": 3177849,
      "categoria": "Governança"
    },
    {
      "data": "2025-12-19",
      "data_hora": "2025-12-19 11:42:53",
      "titulo": " 06/01/2026 10:45",
      "headline": "ECO SEC AGRO (ECOA) CRA E:326 S:1 PROPOSTA AGOE - 06/01/2026 10:45",
      "conteudo": null,
      "url": "https://sistemasweb.b3.com.br/PlantaoNoticias/Noticias/Detail?idNoticia=3177835&agencia=18&dataNoticia=2025-12-19%2011:42:53",
      "id": 3177835,
      "categoria": "Governança"
    },
    {
      "data": "2025-12-19",
      "data_hora": "2025-12-19 11:38:42",
      "titulo": " 06/01/2026 12:00",
      "headline": "ECO SEC AGRO (ECOA) CRA E:323 S:1 PROPOSTA AGOE - 06/01/2026 12:00",
      "conteudo": null,
      "url": "https://sistemasweb.b3.com.br/PlantaoNoticias/Noticias/Detail?idNoticia=3177823&agencia=18&dataNoticia=2025-12-19%2011:38:42",
      "id": 3177823,
      "categoria": "Governança"
    },
    {
      "data": "2025-12-19",
      "data_hora": "2025-12-19 11:37:15",
      "titulo": " 06/01/2026 11:00",
      "headline": "ECO SEC AGRO (ECOA) CRA E:322 S:1 PROPOSTA AGOE - 06/01/2026 11:00",
      "conteudo": null,
      "url": "https://sistemasweb.b3.com.br/PlantaoNoticias/Noticias/Detail?idNoticia=3177819&agencia=18&dataNoticia=2025-12-19%2011:37:15",
      "id": 3177819,
      "categoria": "Governança"
    },
    {
      "data": "2025-12-19",
      "data_hora": "2025-12-19 11:35:47",
      "titulo": " 06/01/2026 11:15",
      "headline": "ECO SEC AGRO (ECOA) CRA E:321 S:1(s) PROPOSTA AGOE - 06/01/2026 11:15",
      "conteudo": null,
      "url": "https://sistemasweb.b3.com.br/PlantaoNoticias/Noticias/Detail?idNoticia=3177816&agencia=18&dataNoticia=2025-12-19%2011:35:47",
      "id": 3177816,
      "categoria": "Governança"
    },
    {
      "data": "2025-12-19",
      "data_hora": "2025-12-19 11:33:50",
      "titulo": " 06/01/2026 10:15",
      "headline": "ECO SEC AGRO (ECOA) CRA E:315 S:1(s) PROPOSTA AGOE - 06/01/2026 10:15",
      "conteudo": null,
      "url": "https://sistemasweb.b3.com.br/PlantaoNoticias/Noticias/Detail?idNoticia=3177809&agencia=18&dataNoticia=2025-12-19%2011:33:50",
      "id": 3177809,
      "categoria": "Governança"
    },
    {
      "data": "2025-12-19",
      "data_hora": "2025-12-19 11:32:31",
      "titulo": " 06/01/2026 15:00",
      "headline": "ECO SEC AGRO (ECOA) CRA E:314 S:1(s) PROPOSTA AGOE - 06/01/2026 15:00",
      "conteudo": null,
      "url": "https://sistemasweb.b3.com.br/PlantaoNoticias/Noticias/Detail?idNoticia=3177803&agencia=18&dataNoticia=2025-12-19%2011:32:31",
      "id": 3177803,
      "categoria": "Governança"
    },
    {
      "data": "2025-12-19",
      "data_hora": "2025-12-19 11:31:09",
      "titulo": " 06/01/2026 10:30",
      "headline": "ECO SEC AGRO (ECOA) CRA E:319 S:1(s) PROPOSTA AGOE - 06/01/2026 10:30",
      "conteudo": null,
      "url": "https://sistemasweb.b3.com.br/PlantaoNoticias/Noticias/Detail?idNoticia=3177798&agencia=18&dataNoticia=2025-12-19%2011:31:09",
      "id": 3177798,
      "categoria": "Governança"
    },
    {
      "data": "2025-12-19",
      "data_hora": "2025-12-19 08:05:11",
      "titulo": " 18/12/2025",
      "headline": "ECO SEC AGRO (ECOA) CRA E:434 S:1(s) PROSPECTO DEFINITIVO - 18/12/2025",
      "conteudo": null,
      "url": "https://sistemasweb.b3.com.br/PlantaoNoticias/Noticias/Detail?idNoticia=3177299&agencia=18&dataNoticia=2025-12-19%2008:05:11",
      "id": 3177299,
      "categoria": "Outros"
    },
    {
      "data": "2025-12-19",
      "data_hora": "2025-12-19 08:05:11",
      "titulo": " 18/12/2025 13:00",
      "headline": "ECO SEC AGRO (ECOA) CRA E:383 S:1 ATA AGOE - 18/12/2025 13:00",
      "conteudo": null,
      "url": "https://sistemasweb.b3.com.br/PlantaoNoticias/Noticias/Detail?idNoticia=3177301&agencia=18&dataNoticia=2025-12-19%2008:05:11",
      "id": 3177301,
      "categoria": "Governança"
    },
    {
      "data": "2025-12-19",
      "data_hora": "2025-12-19 08:05:11",
      "titulo": " 18/12/2025",
      "headline": "ECO SEC AGRO (ECOA) CRA E:383 S:1 ADITAMENTO TERMO SEC. - 18/12/2025",
      "conteudo": null,
      "url": "https://sistemasweb.b3.com.br/PlantaoNoticias/Noticias/Detail?idNoticia=3177302&agencia=18&dataNoticia=2025-12-19%2008:05:11",
      "id": 3177302,
      "categoria": "Outros"
    },
    {
      "data": "2025-12-19",
      "data_hora": "2025-12-19 08:05:10",
      "titulo": " 18/12/2025",
      "headline": "ECO SEC AGRO (ECOA) CRA E:434 S:1(s) Comunicado ao mercado - 18/12/2025",
      "conteudo": null,
      "url": "https://sistemasweb.b3.com.br/PlantaoNoticias/Noticias/Detail?idNoticia=3177297&agencia=18&dataNoticia=2025-12-19%2008:05:10",
      "id": 3177297,
      "categoria": "Aviso"
    },
    {
      "data": "2025-12-19",
      "data_hora": "2025-12-19 08:05:10",
