cd_conta,conta,2020T1,2020T2,2020T3,2020T4,2021T1,2021T2,2021T3
6.01,Caixa Líquido das Atividades Operacionais,-1911000.0,-888000.0,-642000.0,6939000.0,-219000.0,496000.0,1122000.0
6.01.DA,Depreciação e Amortização,314000.0,646000.0,1002000.0,-590000.0,157000.0,324000.0,499000.0
6.02,Caixa Líquido Atividades de Investimento,-385000.0,-359000.0,-690000.0,-3353000.0,-177000.0,-757000.0,-1384000.0
6.03,Caixa Líquido Atividades de Financiamento,891000.0,384000.0,-224000.0,-1844000.0,-372000.0,1240000.0,-389000.0
6.04,Variação Cambial s/ Caixa e Equivalentes,156000.0,455000.0,428000.0,-451000.0,0.0,0.0,0.0
6.05,Aumento (Redução) de Caixa e Equivalentes,-1249000.0,-408000.0,-1128000.0,1291000.0,-768000.0,979000.0,-651000.0
